State,Number,Summary,Bill Type,Date,Status,Erin Reed's State Risk,Notes,URL,Sponsors,Calendar,History,Manual Status,Change Hash,,,,,,,,,,,,,,,,,,,,,,,
Alaska,HB27,Designate Sex For School-sponsored Sports,Trans Sports Ban,1/19/2023,REFERRED TO EDUCATION,Moderate,,https://legiscan.com/AK/bill/HB27/2023,Thomas McKay,,"H 2023-01-19 PREFILE RELEASED 1/9/23, H 2023-01-19 READ THE FIRST TIME - REFERRALS, H 2023-01-19 EDC, HSS, H 2023-01-19 REFERRED TO EDUCATION",,d3f1f1326343d7e96d129e70fc3ba09c,,,,,,,,,,,,,,,,,,,,,,,
Arizona,HB2312,Women's shelters; male employees; liability,Bans trans people from working at shelters,2/21/2023,House minority caucus: Do pass,Low,,https://legiscan.com/AZ/bill/HB2312/2023,"Rachel Jones, Lupe Diaz, Liz Harris, Cory McGarr, Justine Wadsack",Hearing 2023-02-21 12:30 HHR 4,"H 2023-01-17 Introduced in House and read first time, H 2023-01-17 Assigned to House HHS Committee, H 2023-01-17 Assigned to House RULES Committee, H 2023-01-18 House read second time, H 2023-01-23 House HHS Committee action: Do Pass, voting: (5-4-0-0-0-0), H 2023-02-21 House RULES Committee action: constitutional and in proper form, voting: (5-3-0-0-0-0), H 2023-02-21 House consent calendar, H 2023-02-21 House majority caucus: Do pass, H 2023-02-21 House minority caucus: Do pass",Pass Committee,b384154d6055e7754acb897180edd52d,,,,,,,,,,,,,,,,,,,,,,,
Arizona,HB2711,Student information; parental notification; requirements,Forced Outing by Schools,2/8/2023,House read second time,Low,,https://legiscan.com/AZ/bill/HB2711/2023,"Alexander Kolodin, Joseph Chaplik",,"H 2023-02-07 Introduced in House and read first time, H 2023-02-07 Assigned to House ED Committee, H 2023-02-07 Assigned to House RULES Committee, H 2023-02-08 House read second time",,052dda229f95e8b8c06003e9917e543a,,,,,,,,,,,,,,,,,,,,,,,
Arizona,SB1001,Pronouns; biological sex; school policies,Forced Outing by Schools,1/18/2023,"Senate ED Committee action: Do Pass Amended, voting: (4-3-0-0)",Low,Pronoun Ban. It's requires parental permission to refer to a student by a pronound other than the one assigned at birth. ,https://legiscan.com/AZ/bill/SB1001/2023,John Kavanagh,,"S 2022-12-20 Prefile, S 2023-01-10 Introduced in Senate and read first time, S 2023-01-10 Assigned to Senate ED Committee, S 2023-01-10 Assigned to Senate RULES Committee, S 2023-01-11 Senate read second time, S 2023-01-18 Senate ED Committee action: Do Pass Amended, voting: (4-3-0-0)",Pass Committee,fdf14c50bd731eba0927f2610d2b728e,,,,,,,,,,,,,,,,,,,,,,,
Arizona,SB1026,State monies; drag shows; minors,Drag Ban,2/8/2023,"Senate GOV Committee action: Do Pass Amended, voting: (5-3-0-0)",Low,Bans use of state money at places where drag shows for minors occur. ,https://legiscan.com/AZ/bill/SB1026/2023,John Kavanagh,Hearing 2023-02-08 09:30 SHR 2,"S 2023-01-06 Prefile, S 2023-01-17 Introduced in Senate and read first time, S 2023-01-17 Assigned to Senate GOV Committee, S 2023-01-17 Assigned to Senate RULES Committee, S 2023-01-18 Senate read second time, S 2023-02-08 Senate GOV Committee action: Do Pass Amended, voting: (5-3-0-0)",Pass Committee,a62421479d7c05c630eddab77ad4b813,,,,,,,,,,,,,,,,,,,,,,,
Arizona,SB1028,Adult cabaret performances; prohibited locations,Drag Ban,2/2/2023,"Senate JUD Committee action: Do Pass Amended, voting: (4-3-0-0)",Low,Bans trans performers from public. ,https://legiscan.com/AZ/bill/SB1028/2023,Anthony Kern,Hearing 2023-02-02 09:00 SHR 1,"S 2023-01-06 Prefile, S 2023-01-10 Introduced in Senate and read first time, S 2023-01-10 Assigned to Senate JUD Committee, S 2023-01-10 Assigned to Senate RULES Committee, S 2023-01-11 Senate read second time, S 2023-02-02 Senate JUD Committee action: Do Pass Amended, voting: (4-3-0-0)",Pass Committee,6be8d1eee779434bc12f8bd72d69ab69,,,,,,,,,,,,,,,,,,,,,,,
Arizona,SB1030,Drag performers; drag shows; regulation,Drag Ban,2/16/2023,"Senate GOV Committee action: Do Pass Amended, voting: (5-3-0-0)",Low,Requires permit for sexual explicit business if there is a performer of any kind in drag or if the performer is trans. This would ban trans comedy shows for example,https://legiscan.com/AZ/bill/SB1030/2023,Anthony Kern,"Hearing 2023-02-08 09:30 SHR 2, Hearing 2023-02-15 08:00 SHR 2, Hearing 2023-02-16 14:00 SHR 2","S 2023-01-06 Prefile, S 2023-01-10 Introduced in Senate and read first time, S 2023-01-10 Assigned to Senate GOV Committee, S 2023-01-10 Assigned to Senate RULES Committee, S 2023-01-11 Senate read second time, S 2023-02-16 Senate GOV Committee action: Do Pass Amended, voting: (5-3-0-0)",Pass Committee,20e64369ec7f033465c19c24fbe6ea98,,,,,,,,,,,,,,,,,,,,,,,
Arizona,SB1040,Public schools; restrooms; reasonable accommodations,Trans Bathroom Ban,2/21/2023,Senate majority caucus: Do pass,Low,School bathroom ban. ,https://legiscan.com/AZ/bill/SB1040/2023,John Kavanagh,"Hearing 2023-02-15 14:00 SHR 1, Hearing 2023-02-20 13:00 Caucus Room 1","S 2023-01-31 Introduced in Senate and read first time, S 2023-01-31 Assigned to Senate ED Committee, S 2023-01-31 Assigned to Senate RULES Committee, S 2023-02-01 Senate read second time, S 2023-02-15 Senate ED Committee action: Do Pass, voting: (4-2-1-0), S 2023-02-20 Senate RULES Committee action: Proper For Consideration, voting: (4-3-0-0), S 2023-02-20 Senate consent calendar, S 2023-02-20 Senate minority caucus: Do pass, S 2023-02-21 Senate majority caucus: Do pass",Pass Committee,ddc68cd0944c3397e4d2551b529ccecd,,,,,,,,,,,,,,,,,,,,,,,
Arizona,SB1694,Public monies; ideology training; prohibition,DEI Prohibitation,2/15/2023,"Senate GOV Committee action: Do Pass, voting: (5-3-0-0)",Low,,https://legiscan.com/AZ/bill/SB1694/2023,"Jake Hoffman, Sonny Borrelli, Anthony Kern, Justine Wadsack, Justin Heap, Rachel Jones, Cory McGarr","Hearing 2023-02-15 08:00 SHR 2, Hearing 2023-02-16 14:00 SHR 2","S 2023-02-01 Introduced in Senate and read first time, S 2023-02-01 Assigned to Senate GOV Committee, S 2023-02-01 Assigned to Senate RULES Committee, S 2023-02-02 Senate read second time, S 2023-02-15 Senate GOV Committee action: Do Pass, voting: (5-3-0-0)",Pass Committee,78389d7d319faf7eb8570dbea60f8ce9,,,,,,,,,,,,,,,,,,,,,,,
Arizona,SB1698,Unlawful exposure; minors; sentencing; reporting,Drag Ban,2/16/2023,"Senate JUD Committee action: Do Pass, voting: (3-1-3-0)",Low,"5-15 years in prison, added to sex offender registry ",https://legiscan.com/AZ/bill/SB1698/2023,"Justine Wadsack, Rachel Jones, Cory McGarr",Hearing 2023-02-16 08:00 SHR 1,"S 2023-02-02 Introduced in Senate and read first time, S 2023-02-02 Assigned to Senate JUD Committee, S 2023-02-02 Assigned to Senate RULES Committee, S 2023-02-09 Senate read second time, S 2023-02-16 Senate JUD Committee action: Do Pass, voting: (3-1-3-0)",Pass Committee,d1b467e82b5928edad2d043cdae5d1ce,,,,,,,,,,,,,,,,,,,,,,,
Arizona,SB1702,Gender transition; prohibitions; hormone therapies,Gender Affirming Care Ban,2/2/2023,Senate read second time,Low,Force detransition explicitly,https://legiscan.com/AZ/bill/SB1702/2023,"Justine Wadsack, Rachel Jones, Cory McGarr",,"S 2023-02-01 Introduced in Senate and read first time, S 2023-02-01 Assigned to Senate HHS Committee, S 2023-02-01 Assigned to Senate RULES Committee, S 2023-02-02 Senate read second time",,8180e70db473f6a0417dd3da580e8790,,,,,,,,,,,,,,,,,,,,,,,
Arkansas,HB1156,Concerning A Public School District Or Open-enrollment Public Charter School Policy Relating To A Public School Student&#x27;s Sex.,Trans Bathroom Ban,2/15/2023,"Returned by the Committee, with the recommendation that it Do Pass",Worst,,https://legiscan.com/AR/bill/HB1156/2023,"Mary Bentley, Dan Sullivan, Karilyn Brown, Cindy Crawford, DeAnna Hodges, Jack Ladyman, Wayne Long, Robin Lundstrum, Mindy McAlindon, Josh Miller, Ryan Rose, Dwight Tosh, Sonia Eubanks Barker","Hearing 2023-01-19 10:00 Room 138, Hearing 2023-01-24 10:00 Room 138, Hearing 2023-01-30 10:00 Room 138, Hearing 2023-01-31 10:00 Room 138, Hearing 2023-02-08 10:00 Room 207, Hearing 2023-02-13 10:00 Room 207, Hearing 2023-02-14 10:00 Room 207, Hearing 2023-02-15 10:00 Room 207","H 2023-01-17 Filed, H 2023-01-17 Read the first time, rules suspended, read the second time and referred to the Committee on EDUCATION COMMITTEE- HOUSE, H 2023-01-24 Placed on second reading for the purpose of amendment., H 2023-01-24 Amendment No. 1 read and adopted and the bill ordered engrossed., H 2023-01-24 REPORTED CORRECTLY ENGROSSED, H 2023-01-30 Placed on second reading for the purpose of amendment., H 2023-01-30 Amendment No. 2 read and adopted and the bill ordered engrossed., H 2023-01-30 REPORTED CORRECTLY ENGROSSED, H 2023-01-31 Returned by the Committee Do Pass, H 2023-02-01 Read the third time and passed and ordered transmitted to the Senate., S 2023-02-01 Received from the House., S 2023-02-01 Read first time, rules suspended, read second time, referred to EDUCATION COMMITTEE - SENATE, S 2023-02-15 Returned by the Committee, with the recommendation that it Do Pass",Pass One Chamber,f7257db3591780a9227ae644a447f6e5,,,,,,,,,,,,,,,,,,,,,,,
Arkansas,SB125,To Amend The Restrictions An Institution Of Higher Education May Impose On Free Expression; And To Amend The Areas That Constitute A Public Forum For Members Of A Campus Community.,Legal Discrimination In Education,2/9/2023,Re-referred to EDUCATION COMMITTEE - SENATE,Worst,,https://legiscan.com/AR/bill/SB125/2023,"Dan Sullivan, Rick Beck","Hearing 2023-02-01 10:00 Room 207, Hearing 2023-02-08 10:00 Room 207","S 2023-01-25 Filed, S 2023-01-25 Read first time, rules suspended, read second time, referred to EDUCATION COMMITTEE - SENATE, S 2023-02-09 Withdrawn from Committee for purpose of amendment # 1, S 2023-02-09 Placed on second reading for purpose of amendment., S 2023-02-09 Amendment # 1 read the first time, rules suspended, read the second time and adopted, ordered engrossed., S 2023-02-09 REPORTED CORRECTLY ENGROSSED, S 2023-02-09 Re-referred to EDUCATION COMMITTEE - SENATE",,e24dc9f536746c348692a10d39cabeea,,,,,,,,,,,,,,,,,,,,,,,
Arkansas,SB199,Concerning Medical Malpractice And Gender Transition In Minors; And To Create The Protecting Minors From Medical Malpractice Act Of 2023. ,Gender Affirming Care Ban,2/21/2023,"Read the first time, rules suspended, read the second time and referred to the Committee on JUDICIARY COMMITTEE- HOUSE",Worst,bad bad one,https://legiscan.com/AR/bill/SB199/2023,"Gary Stubblefield, Mary Bentley","Hearing 2023-02-08 10:00 Room 171, Hearing 2023-02-13 10:00 Room 171, Hearing 2023-02-20 10:00 Room 171","S 2023-02-06 Filed, S 2023-02-06 Read first time, rules suspended, read second time, referred to JUDICIARY COMMITTEE - SENATE, S 2023-02-13 Returned by the Committee, with the recommendation that it Do Pass, S 2023-02-15 Re-referred to JUDICIARY COMMITTEE - SENATE, S 2023-02-16 Withdrawn from Committee for purpose of amendment # 1, S 2023-02-16 Placed on second reading for purpose of amendment., S 2023-02-16 Amendment # 1 read the first time, rules suspended, read the second time and adopted, ordered engrossed., S 2023-02-16 REPORTED CORRECTLY ENGROSSED, S 2023-02-16 Re-referred to JUDICIARY COMMITTEE - SENATE, S 2023-02-20 Returned by the Committee, with the recommendation that it Do Pass, S 2023-02-21 Read the third time and passed., S 2023-02-21 Ordered immediately transmitted to the House., H 2023-02-21 RECEIVED FROM THE SENATE, H 2023-02-21 Read the first time, rules suspended, read the second time and referred to the Committee on JUDICIARY COMMITTEE- HOUSE",PAss One Chamber,bb3a89875d4cd1642199622867dfe971,,,,,,,,,,,,,,,,,,,,,,,
Arkansas,SB270,To Amend The Criminal Offense Of Sexual Indecency With A Child.,Trans Bathroom Ban,2/22/2023,Re-referred to JUDICIARY COMMITTEE - SENATE,Worst,Adult ban in all public restrooms,https://legiscan.com/AR/bill/SB270/2023,"John Payton, Cindy Crawford, Ben Gilmore, Missy Irvin, Blake Johnson, Mark Johnson, Matt Stone, David Wallace","Hearing 2023-02-20 10:00 Room 171, Hearing 2023-02-21 10:00 Room 171, Hearing 2023-02-22 10:00 Room 171","S 2023-02-15 Filed, S 2023-02-15 Read first time, rules suspended, read second time, referred to JUDICIARY COMMITTEE - SENATE, S 2023-02-22 Withdrawn from Committee for purpose of amendment # 1, S 2023-02-22 Placed on second reading for purpose of amendment., S 2023-02-22 Amendment # 1 read the first time, rules suspended, read the second time and adopted, ordered engrossed., S 2023-02-22 REPORTED CORRECTLY ENGROSSED, S 2023-02-22 Re-referred to JUDICIARY COMMITTEE - SENATE",,feca3f641cd0171bc0a69b061a4d3c7a,,,,,,,,,,,,,,,,,,,,,,,
Arkansas,SB43,To Add Certain Restrictions To An Adult-oriented Performance; And To Define An Adult-oriented Performance.,Drag Ban,2/22/2023,DELIVERED TO GOVERNOR.,Worst,Anti trans ban. ,https://legiscan.com/AR/bill/SB43/2023,"Gary Stubblefield, Mary Bentley, Sonia Eubanks Barker, Cameron Cooper, Cindy Crawford, Delia Haak, DeAnna Hodges, Jack Ladyman, Wayne Long, Robin Lundstrum, Mindy McAlindon, Scott Richardson, Ryan Rose, Johnny Rye, Dwight Tosh, Joshua Bryant, Blake Johnson, Kim Hammer, Terry Rice, Scott Flippo, Clint Penzo, Ben Gilmore, Matt Stone, Matt McKee, Alan Clark, Bart Hester, Tyler Dees, Dan Sullivan, Ronald Caldwell, Ricky Hill","Hearing 2023-02-01 10:00 Room A, MAC, Hearing 2023-02-13 10:00 Room 272, Hearing 2023-02-14 10:00 Room 272, Hearing 2023-02-16 10:00 Room 272, Hearing 2023-02-20 10:00 Room 272, Hearing 2023-02-21 10:00 Room 272","S 2023-01-09 Filed, S 2023-01-09 Read first time, rules suspended, read second time, referred to CITY, COUNTY & LOCAL AFFAIRS COMMITTEE - SENATE, S 2023-01-19 Returned by the Committee with the recommendation that it Do Pass as amended, Amendment # 1, S 2023-01-23 Placed on second reading for purpose of amendment., S 2023-01-23 Amendment # 1 read the first time, rules suspended, read the second time and adopted, ordered engrossed., S 2023-01-23 REPORTED CORRECTLY ENGROSSED, S 2023-01-24 Read the third time and passed., S 2023-01-24 Ordered immediately transmitted to the House., H 2023-01-24 RECEIVED FROM THE SENATE, H 2023-01-24 Read the first time, rules suspended, read the second time and referred to the Committee on CITY, COUNTY & LOCAL AFFAIRS COMMITTEE- HOUSE, H 2023-01-30 Placed on second reading for the purpose of amendment., H 2023-01-30 Amendment No. 1 read and adopted and the bill ordered engrossed., H 2023-01-30 REPORTED CORRECTLY ENGROSSED, H 2023-02-01 Returned by the Committee with the recommendation that it do pass as amended 2, H 2023-02-02 Placed on second reading for the purpose of amendment., H 2023-02-02 Amendment No. 2 read and adopted and the bill ordered engrossed., H 2023-02-02 REPORTED CORRECTLY ENGROSSED, H 2023-02-06 Read the third time and passed and ordered transmitted to the Senate., H 2023-02-06 Returned To Senate as passed, as amended # 1 & 2, S 2023-02-07 Returned from the House as passed as amended #1 & 2, S 2023-02-07 Re-referred to CITY, COUNTY & LOCAL AFFAIRS COMMITTEE - SENATE, S 2023-02-21 Returned by the Committee with the recommendation that it Do Pass as amended, Amendment # 1 & 2, S 2023-02-22 Placed on second reading for purpose of amendment., S 2023-02-22 House Amendment No. 1 read first time, rule suspended, read second time and concurred in., S 2023-02-22 House Amendment No. 2 read first time, rule suspended, read second time and concurred in., S 2023-02-22 Rules suspended., S 2023-02-22 Read the third time and passed., S 2023-02-22 ORDERED ENROLLED, S 2023-02-22 Reported correctly enrolled and ordered delivered to the Governor., S 2023-02-22 DELIVERED TO GOVERNOR.",Pass Both Chambers,368c2ad444e4c28252303e1aa09b44b6,,,,,,,,,,,,,,,,,,,,,,,
Arkansas,HB1468,"To Prohibit Requiring Faculty Members, Teachers, And Employees Of Public Schools And State-supported Institutions Of Higher Education To Use A Person&#x27;s Preferred Pronoun.",Forced Misgendering,2/20/2023,"Read the first time, rules suspended, read the second time and referred to the Committee on EDUCATION COMMITTEE- HOUSE",Worst,Allows for school staff to misgender through college,https://legiscan.com/AR/bill/HB1468/2023,Wayne Long,,"H 2023-02-20 Filed, H 2023-02-20 Read the first time, rules suspended, read the second time and referred to the Committee on EDUCATION COMMITTEE- HOUSE",,de19f5bcc40c6cacd9bda390a8e7de97,,,,,,,,,,,,,,,,,,,,,,,
Arkansas,SB294,To Create The Learns Act; To Amend Various Provisions Of The Arkansas Code As They Relate To Early Childhood Through Grade Twelve (12) Education In The State Of Arkansas; To Declare An Emergency; And To Declare An Emergency.,Don't Say Gay/Forced Outing,2/23/2023,"Read the first time, rules suspended, read the second time and referred to the Committee on EDUCATION COMMITTEE- HOUSE",Worst,,https://legiscan.com/AR/bill/SB294/2023,"Breanne Davis, Keith Brooks, Matthew Shepherd, Austin Mccollum, Brit McKenzie, Aaron Pilkington, Stephen Meeks, Jeff Wardlaw, Jon Eubanks, Bruce Cozart, Richard Womack, Charlene Fite, Robin Lundstrum, Mary Bentley, Justin Gonzales, Rick Beck, Karilyn Brown, Marcus Richmond, Jack Fortner, Frances Cavenaugh, John Maddox, Sonia Eubanks Barker, Johnny Rye, Steve Hollowell, Danny Watson, Roger Lynch, Carlton Wing, Cindy Crawford, Lee Johnson, Cameron Cooper, Harlan Breaux, Brian Evans, Richard McGrew, David Ray, Howard Beaty, Rick McClure, Jon Milligan, Delia Haak, John Carr, Kendon Underwood, Tony Furman, Grant Hodges, Jeremiah Moore, Brandon Achor, Rebecca Burkes, RJ Hawk, Mindy McAlindon, Matt Brown, Ryan Rose, Chad Puryear, Zack Gramlich, Stetson Painter, Matt Duffield, Steve Unger, Scott Richardson, Wade Andrews, Bart Hester, Missy Irvin, Jonathan Dismang, Jane English, Gary Stubblefield, Scott Flippo, Blake Johnson, David Wallace, Ricky Hill, Mark Johnson, Kim Hammer, Dan Sullivan, Ben Gilmore, Matt McKee, Clint Penzo, Justin Boyd, Jim Petty, Joshua Bryant, Steve Crowell, Matt Stone, Tyler Dees, John Payton, Jim Dotson, Alan Clark","Hearing 2023-02-20 09:00 Room A, MAC, Hearing 2023-02-21 09:00 Room A, MAC, Hearing 2023-02-22 09:00 Room A, MAC","S 2023-02-20 Filed, S 2023-02-20 Read first time, rules suspended, read second time, referred to EDUCATION COMMITTEE - SENATE, S 2023-02-22 Returned by the Committee, with the recommendation that it Do Pass, S 2023-02-23 Read the third time and passed., S 2023-02-23 EMERGENCY CLAUSE ADOPTED, S 2023-02-23 Ordered immediately transmitted to the House., H 2023-02-23 RECEIVED FROM THE SENATE, H 2023-02-23 Read the first time, rules suspended, read the second time and referred to the Committee on EDUCATION COMMITTEE- HOUSE",Pass One Chamber,2adf22a633cd7b2be28d1687d1111909,,,,,,,,,,,,,,,,,,,,,,,
Colorado,HB1092,Limitating Use Of State Money,Ban on Public Investment in ESG Funds,2/6/2023,House Committee on Finance Postpone Indefinitely,Safest,Bans public money from investing in funds that don't invest in companies that fail to provide gender affirming care,https://legiscan.com/CO/bill/HB1092/2023,Rod Bockenfeld,Hearing 2023-02-06 13:30 Room 0112,"H 2023-01-19 Introduced In House - Assigned to Finance, H 2023-02-06 House Committee on Finance Postpone Indefinitely",,3e4faa246c6398ec22e9bfff6e9d5f84,,,,,,,,,,,,,,,,,,,,,,,
Colorado,HB1098,Women&#039;s Rights In Athletics,Trans Sports Ban,2/13/2023,"House Committee on State, Civic, Military, & Veterans Affairs Postpone Indefinitely",Safest,,https://legiscan.com/CO/bill/HB1098/2023,"Brandi Bradley, Lisa Frizell, Byron Pelton, Ryan Armagost, Anthony Hartsook, Ron Weinberg, Ty Winter",Hearing 2023-02-13 13:30 Room LSB-A,"H 2023-01-23 Introduced In House - Assigned to State, Civic, Military, & Veterans Affairs, H 2023-02-13 House Committee on State, Civic, Military, & Veterans Affairs Postpone Indefinitely",,1b9b73bdad306030faca867b1016bb74,,,,,,,,,,,,,,,,,,,,,,,
Connecticut,HB06213,An Act Prohibiting Student Athletes Who Were Born As Males From Participating In Women's Interscholastic Athletic Events.,Trans Sports Ban,1/19/2023,Referred to Joint Committee on Education,Safest,,https://legiscan.com/CT/bill/HB06213/2023,Douglas Dubitsky,,H 2023-01-19 Referred to Joint Committee on Education,,f1e5c73e6489374f01fbdd7d00021fc5,,,,,,,,,,,,,,,,,,,,,,,
Connecticut,HB06331,An Act Requiring Public School Educators To Recognize Each Student By The Biological Gender Of Such Student.,Forced Misgendering,1/20/2023,Referred to Joint Committee on Education,Safest,,https://legiscan.com/CT/bill/HB06331/2023,Joe Hoxha,,H 2023-01-20 Referred to Joint Committee on Education,,6c5d44f4a587088868435aab68baed7c,,,,,,,,,,,,,,,,,,,,,,,
Connecticut,SB00467,An Act Concerning Gender-specific Facilities And Activities In Private Businesses.,Trans Bathroom Ban,1/18/2023,Referred to Joint Committee on Judiciary,Safest,Permits businesses to ban trans people from bathrooms,https://legiscan.com/CT/bill/SB00467/2023,Robert Sampson,,S 2023-01-18 Referred to Joint Committee on Judiciary,,dcef1447e9edf545479a0f77b8b552e7,,,,,,,,,,,,,,,,,,,,,,,
Connecticut,SB00468,An Act Concerning Civil Immunity For Interscholastic Athletic Organizations And The Sanctioning Bodies Of Private Youth Organizations.,Trans Sports Ban,1/18/2023,Referred to Joint Committee on Judiciary,Safest,,https://legiscan.com/CT/bill/SB00468/2023,Robert Sampson,,S 2023-01-18 Referred to Joint Committee on Judiciary,,1b4f50c06ec227fe3c66d49f9d6bed47,,,,,,,,,,,,,,,,,,,,,,,
Connecticut,SB00544,An Act Concerning The Use Of A Nonbinary Marker On Birth Certificates.,Birth Certificate Change Ban,1/18/2023,Referred to Joint Committee on Public Health,Safest,,https://legiscan.com/CT/bill/SB00544/2023,Robert Sampson,,S 2023-01-18 Referred to Joint Committee on Public Health,,c291b7d1f2a9eb9b6ada0fda01ec7dd9,,,,,,,,,,,,,,,,,,,,,,,
Florida,S0952,Employer Coverage of Gender Dysphoria Treatment,Gender Affirming Care Ban,2/20/2023,Filed,Worst,Essentially bans for all adults,https://legiscan.com/FL/bill/S0952/2023,Blaise Ingoglia,,S 2023-02-20 Filed,,3ea6decd2ca481ad9857f8624646f47e,,,,,,,,,,,,,,,,,,,,,,,
Florida,H0991,"Defamation, False Light, and Unauthorized Publication of Name or Likenesses",Defamation Bill,2/21/2023,Filed,Worst,,https://legiscan.com/FL/bill/H0991/2023,Alex Andrade,,H 2023-02-21 Filed,,4bf941dfbb4afd42d0bfc5cb26697307,,,,,,,,,,,,,,,,,,,,,,,
Florida,H1069,Education,Legal Discrimination In Education,2/22/2023,Filed,Worst,Erases trans people from sex education,https://legiscan.com/FL/bill/H1069/2023,Stan McClain,,H 2023-02-22 Filed,,67eefb1b3b07813502e56b2947f31a73,,,,,,,,,,,,,,,,,,,,,,,
Georgia,SB140,Hospitals; the treatment of gender dysphoria in minors performed in hospitals and other licensed healthcare facilities; prohibit certain surgical procedures,Gender Affirming Care Ban,2/23/2023,Senate Committee Favorably Reported By Substitute,Moderate,,https://legiscan.com/GA/bill/SB140/2023,"Carden Summers, Ben Watson, Kay Kirkpatrick, John Kennedy, Lee Anderson, Matt Brass, Jason Anavitarte, Billy Hickman, John Albers, Ed Setzler, Shawn Still, Brandon Beach, Russ Goodman, Sam Watson, Chuck Payne, Larry Walker, Blake Tillery, Brian Strickland, Marty Harbin, Ricky Williams, Clint Dixon, Colton Moore",Hearing 2023-02-22 15:00 450 CAP,"S 2023-02-09 Senate Hopper, S 2023-02-13 Senate Read and Referred, S 2023-02-23 Senate Committee Favorably Reported By Substitute",Pass Committee,e1a4b6b80f82402f7cdebe14d590e09e,,,,,,,,,,,,,,,,,,,,,,,
Georgia,SB141,Professions and Businesses; health care providers from performing specified practices on minors relating to altering a person's appearance relating to gender; prohibit,Gender Affirming Care Ban,2/13/2023,Senate Read and Referred,Moderate,GAC Ban + Forced outing,https://legiscan.com/GA/bill/SB141/2023,"Clint Dixon, Steve Gooch, Marty Harbin, Randy Robertson, Shawn Still, John Albers, Matt Brass, Greg Dolezal, Shelly Echols, Colton Moore, Lee Anderson, Max Burns, Ed Setzler, Sam Watson, Carden Summers",,"S 2023-02-09 Senate Hopper, S 2023-02-13 Senate Read and Referred",,7e91b8c0bfdf541aa03c15a172db6b3a,,,,,,,,,,,,,,,,,,,,,,,
Georgia,SB88,"""Parents and Children Protection Act of 2023""; enact",Don't Say Gay/Forced Outing,2/6/2023,Senate Read and Referred,Moderate,With additional parts about dressing in a sexually provocative manner. Goes up to 16,https://legiscan.com/GA/bill/SB88/2023,"Carden Summers, Colton Moore, Brandon Beach, Clint Dixon, Randy Robertson, John Albers, Shawn Still, Lee Anderson, Matt Brass, Chuck Payne, Marty Harbin",,"S 2023-02-02 Senate Hopper, S 2023-02-06 Senate Read and Referred",,b16fd025769727003fd9ad23f1d9a1f2,,,,,,,,,,,,,,,,,,,,,,,
Hawaii,HB291,Relating To Certificates Of Birth.,Birth Certificate Change Ban,1/25/2023,"Referred to HLT, JHA, referral sheet 1",Safest,,https://legiscan.com/HI/bill/HB291/2023,David Alcos,,"H 2023-01-19 Pending introduction., H 2023-01-20 Introduced and Pass First Reading., H 2023-01-25 Referred to HLT, JHA, referral sheet 1",,0b20d5836dabc71e1216484235e6c904,,,,,,,,,,,,,,,,,,,,,,,
Hawaii,HB508,Relating To Sex-specific Student Athletic Teams.,Trans Sports Ban,1/27/2023,"Referred to EDN, JHA, FIN, referral sheet 2",Safest,,https://legiscan.com/HI/bill/HB508/2023,Diamond Garcia,,"H 2023-01-20 Pending introduction., H 2023-01-23 Introduced and Pass First Reading., H 2023-01-27 Referred to EDN, JHA, FIN, referral sheet 2",,83bacd969db0aaf9f01a3cae997fc94b,,,,,,,,,,,,,,,,,,,,,,,
Hawaii,HB509,Relating To Parental Rights In Education.,Don't Say Gay/Forced Outing,1/27/2023,"Referred to EDN, JHA, FIN, referral sheet 2",Safest,,https://legiscan.com/HI/bill/HB509/2023,Diamond Garcia,,"H 2023-01-20 Pending introduction., H 2023-01-23 Introduced and Pass First Reading., H 2023-01-27 Referred to EDN, JHA, FIN, referral sheet 2",,2a3edad3bdb3b589a228ad99539997a6,,,,,,,,,,,,,,,,,,,,,,,
Hawaii,HB891,Relating To Gender Transition Surgery.,Gender Affirming Care Ban,1/30/2023,"Referred to HLT, JHA, FIN, referral sheet 3",Safest,,https://legiscan.com/HI/bill/HB891/2023,Diamond Garcia,,"H 2023-01-23 Pending introduction., H 2023-01-25 Introduced and Pass First Reading., H 2023-01-30 Referred to HLT, JHA, FIN, referral sheet 3",,a5fdeba030f7d7106691432817a6a5eb,,,,,,,,,,,,,,,,,,,,,,,
Hawaii,SB1428,Relating To Parental Rights In Education.,Don't Say Gay/Forced Outing,1/30/2023,"Referred to EDU/HHS, JDC/WAM.",Safest,,https://legiscan.com/HI/bill/SB1428/2023,Brenton Awa,,"S 2023-01-25 Introduced., S 2023-01-25 Passed First Reading., S 2023-01-30 Referred to EDU/HHS, JDC/WAM.",,2a8bc193a984d10d67d480b79bb71acd,,,,,,,,,,,,,,,,,,,,,,,
Hawaii,SB1429,Relating To Sex-specific Student Athletic Teams.,Trans sports Ban,1/30/2023,"Referred to EDU/HHS/EET, JDC/WAM.",Safest,,https://legiscan.com/HI/bill/SB1429/2023,Brenton Awa,,"S 2023-01-25 Introduced., S 2023-01-25 Passed First Reading., S 2023-01-30 Referred to EDU/HHS/EET, JDC/WAM.",,18ec52d3c4eaab908a5d05005dc2a47f,,,,,,,,,,,,,,,,,,,,,,,
Idaho,H0071,Amends existing law to revise provisions regarding the crime of genital mutilation of a child.,Gender Affirming Care Ban,2/15/2023,"Introduced, read first time; referred to: Judiciary & Rules",High,,https://legiscan.com/ID/bill/H0071/2023,"Judiciary, Rules and Administration Committee, Ben Adams, Brent Crane, Daniel Foreman, Kevin Andrus, Glenneda Zuiderveld, Jordan Redman, Tammy Nichols, Brandon Mitchell, Jeff Cornilles, Kenny Wroten, Lance Clow, Jaron Crane, Julianne Young, Joe Alfieri, Vito Barbieri, Heather Scott, Jacyn Gallagher, Mike Kingsley, Dale Hawkins, Charlie Shepherd, Elaine Price",Hearing 2023-02-07 13:30 Room EW42,"H 2023-02-02 Introduced, read first time, referred to JRA for Printing, H 2023-02-03 Reported Printed and Referred to State Affairs, H 2023-02-06 Reported out of Committee, Returned to the Desk for re-referral, H 2023-02-06 Referred to Judiciary, Rules & Administration, H 2023-02-08 Reported out of Committee with Do Pass Recommendation, Filed for Second Reading, H 2023-02-09 Read second time; Filed for Third Reading, H 2023-02-10 U.C. to hold place on third reading calendar until Tuesday, February 14, 2023, H 2023-02-14 Read Third Time in Full -- PASSED 58-12-0, H 2023-02-14 Title apvd, H 2023-02-14 to Senate, S 2023-02-15 Received from the House passed; filed for first reading, S 2023-02-15 Introduced, read first time; referred to: Judiciary & Rules",Pass One Chamber,d55f28c9c223e7bfdcb46f8fda63e73b,,,,,,,,,,,,,,,,,,,,,,,
Idaho,S1003,"Amends existing law to provide that a bidder, offeror, contractor, or subcontractor shall not be required to provide access to a multiple occupancy restroom, multiple occupancy shower facility, or multiple occupancy changing room on any basis other than biological sex.",Trans Bathroom Ban,1/17/2023,Reported Printed; referred to State Affairs,High,Does not require any public works contractors to provide gender neutral bathrooms and can have it based on biological sex. Emergency action,https://legiscan.com/ID/bill/S1003/2023,State Affairs Committee,,"S 2023-01-16 Introduced; read first time; referred to JR for Printing, S 2023-01-17 Reported Printed; referred to State Affairs",,ecb10fbdad6a8fbb4d99d9cf6f50bc7f,,,,,,,,,,,,,,,,,,,,,,,
Idaho,S1016,"Amends existing law to provide that a public works contractor shall not be required to provide access to a multiple-occupancy restroom, multiple-occupancy shower facility, or multiple-occupancy changing room on any basis other than biological sex.",Trans Bathroom Ban,2/21/2023,"Reported out of Committee, Recommend place on General Orders",High,"may affect adults, public owned buildings/contractors",https://legiscan.com/ID/bill/S1016/2023,State Affairs Committee,"Hearing 2023-02-01 08:00 Room WW55, Hearing 2023-02-21 09:00 Room EW40","S 2023-01-20 Introduced; read first time; referred to JR for Printing, S 2023-01-23 Reported Printed; referred to State Affairs, S 2023-02-02 Reported out of Committee with Do Pass Recommendation; Filed for second reading, S 2023-02-03 Read second time; filed for Third Reading, S 2023-02-08 Read third time in full -- PASSED 28-7-0, S 2023-02-08 Title apvd, S 2023-02-08 to House, H 2023-02-09 Received from the Senate, Filed for First Reading, H 2023-02-09 Read First Time, Referred to State Affairs, H 2023-02-21 Reported out of Committee, Recommend place on General Orders",Pass One Chamber,5e19f30c5770e827caccb732afdb4f49,,,,,,,,,,,,,,,,,,,,,,,
Idaho,S1100,Adds to existing law to establish privacy and safety standards in public schools.,Trans Bathroom Ban,2/24/2023,Reported out of Committee with Do Pass Recommendation; Filed for second reading,High,,https://legiscan.com/ID/bill/S1100/2023,Education Committee,"Hearing 2023-02-21 15:00 Room WW55, Hearing 2023-02-23 15:00 Room WW55","S 2023-02-13 Introduced; read first time; referred to JR for Printing, S 2023-02-14 Reported Printed; referred to Education, S 2023-02-24 Reported out of Committee with Do Pass Recommendation; Filed for second reading",Pass Committee,755d205caf8c1288106482bbb48bf308,,,,,,,,,,,,,,,,,,,,,,,
Illinois,HB1562,INTERSCHOLASTIC SPORTS-GENDER,Trans Sports Ban,1/31/2023,Referred to Rules Committee,Safest,,https://legiscan.com/IL/bill/HB1562/2023,David Friess,,"H 2023-01-30 Filed with the Clerk by Rep. David Friess, H 2023-01-31 First Reading, H 2023-01-31 Referred to Rules Committee",,791fe4fd25d5a21383835b67a2014848,,,,,,,,,,,,,,,,,,,,,,,
Illinois,SB1659,SCH CD-BIO-RESTROOM ACCESS,Trans Bathroom Ban,2/8/2023,Referred to Assignments,Safest,,https://legiscan.com/IL/bill/SB1659/2023,Andrew Chesney,,"S 2023-02-08 Filed with Secretary by Sen. Andrew S. Chesney, S 2023-02-08 First Reading, S 2023-02-08 Referred to Assignments",,9482011fabc0c7267d054c8f37ccf44d,,,,,,,,,,,,,,,,,,,,,,,
Indiana,HB1118,Prohibited services relating to care of minors.,Gender Affirming Care Ban,1/12/2023,Representative Payne Z added as coauthor,High,Felony healthcare ban. Considers gender affirming care as conversion therapy . ,https://legiscan.com/IN/bill/HB1118/2023,"Lorissa Sweet, Zach Payne",,"H 2023-01-10 Authored by Representative Sweet, H 2023-01-10 First reading: referred to Committee on Public Health, H 2023-01-12 Representative Payne Z added as coauthor",,eb43cf47210bae0dda188368ab79b7ed,,,,,,,,,,,,,,,,,,,,,,,
Indiana,HB1220,Gender transition procedures for minors.,Gender Affirming Care Ban,1/10/2023,First reading: referred to Committee on Public Health,High,,https://legiscan.com/IN/bill/HB1220/2023,"Michelle Davis, Dale DeVon, Jake Teshka, Christopher Judy",,"H 2023-01-10 Coauthored by Representatives DeVon, Teshka, Judy, H 2023-01-10 Authored by Representative Davis, H 2023-01-10 First reading: referred to Committee on Public Health",,9d298369ca2143e2a8992a8eba9ac60d,,,,,,,,,,,,,,,,,,,,,,,
Indiana,HB1231,Gender transition procedures for minors.,Gender Affirming Care Ban,1/19/2023,Representatives Prescott and Abbott D added as coauthors,High,Healthcare ban under 18. Does not require insurance coverage for gender affirming care regardless of age. ,https://legiscan.com/IN/bill/HB1231/2023,"Ryan Lauer, John Prescott, David Abbott",,"H 2023-01-10 Authored by Representative Lauer, H 2023-01-10 First reading: referred to Committee on Public Health, H 2023-01-19 Representatives Prescott and Abbott D added as coauthors",,316cf640f6556f7e7f03f2811bdd8ad6,,,,,,,,,,,,,,,,,,,,,,,
Indiana,HB1232,Child removal and gender identity.,Denial of GAC can't be considered Child Abuse,1/12/2023,Representative Davis M added as coauthor,High,,https://legiscan.com/IN/bill/HB1232/2023,"Ryan Lauer, Michelle Davis",,"H 2023-01-10 Authored by Representative Lauer, H 2023-01-10 First reading: referred to Committee on Family, Children and Human Affairs, H 2023-01-12 Representative Davis M added as coauthor",,f11f848fa36d52e1e2a5718df7d0360b,,,,,,,,,,,,,,,,,,,,,,,
Indiana,HB1346,Gender fluidity.,Forced Misgendering,1/17/2023,First reading: referred to Committee on Education,High,"Forced misgendering of students and staff by defining it as ""gender fluidity.""",https://legiscan.com/IN/bill/HB1346/2023,"Jake Teshka, Joanna King, Martin Carbaugh, Timothy Wesco",,"H 2023-01-17 Coauthored by Representatives King, Carbaugh, Wesco, H 2023-01-17 Authored by Representative Teshka, H 2023-01-17 First reading: referred to Committee on Education",,4ab01af055c845a17cd60309847f2d50,,,,,,,,,,,,,,,,,,,,,,,
Indiana,HB1407,Parental rights.,Don't Say Gay/Forced Outing,2/23/2023,Referred to the Senate,High,Explicetly makes not providing gender affirming care legal and NOT child abuse,https://legiscan.com/IN/bill/HB1407/2023,"Dale DeVon, Chris Jeter, Robert Heaton, Lindsay Patterson, Aaron Freeman, Stacey Donato, Jeff Raatz",Hearing 2023-02-09 08:30 Room 156-B,"H 2023-01-17 Authored by Representative DeVon, H 2023-01-17 First reading: referred to Committee on Family, Children and Human Affairs, H 2023-01-31 Representative Jeter C added as coauthor, H 2023-01-31 Representative Heaton added as coauthor, H 2023-02-06 Representative Patterson L added as coauthor, H 2023-02-13 Committee report: amend do pass, adopted, H 2023-02-16 Second reading: ordered engrossed, H 2023-02-20 Placed back on second reading, H 2023-02-21 Amendment #2 (Jeter) prevailed; voice vote, H 2023-02-21 Second reading: amended, ordered engrossed, H 2023-02-22 Third reading: passed; Roll Call 199: yeas 58, nays 33, H 2023-02-22 Senate sponsors: Senators Freeman, Donato, Raatz",Pass One Chamber,aff2bc45c6c0aef065ede357f73bd1af,,,,,,,,,,,,,,,,,,,,,,,
Indiana,HB1525,Prohibited health care for minors.,Gender Affirming Care Ban,1/19/2023,First reading: referred to Committee on Public Health,High,,https://legiscan.com/IN/bill/HB1525/2023,Bruce Borders,,"H 2023-01-19 Authored by Representative Borders, H 2023-01-19 First reading: referred to Committee on Public Health",,32d07252f54db212edfb9982fec2e4a4,,,,,,,,,,,,,,,,,,,,,,,
Indiana,HB1608,Human sexuality instruction.,Prohibits Gender Identity Instruction,2/24/2023,Referred to the Senate,High,,https://legiscan.com/IN/bill/HB1608/2023,"Michelle Davis, Jake Teshka, Chris Jeter, Robert Heaton, Stacey Donato, Jeff Raatz, Gary Byrne",Hearing 2023-02-20 08:00 House Chamber,"H 2023-01-19 Coauthored by Representatives Teshka, Jeter, Heaton, H 2023-01-19 Authored by Representative Davis, H 2023-01-19 First reading: referred to Committee on Education, H 2023-02-20 Committee report: amend do pass, adopted, H 2023-02-22 Second reading: ordered engrossed, H 2023-02-23 Third reading: passed; Roll Call 220: yeas 65, nays 29, H 2023-02-23 Senate sponsors: Senators Donato, Raatz, Byrne, H 2023-02-24 Referred to the Senate",Pass One Chamber,9c621cece573273865c643f6fd59a6a3,,,,,,,,,,,,,,,,,,,,,,,
Indiana,SB0354,Education matters.,Don't Say Gay/Forced Outing,1/12/2023,First reading: referred to Committee on Education and Career Development,High,,https://legiscan.com/IN/bill/SB0354/2023,Jeff Raatz,,"S 2023-01-12 Authored by Senator Raatz, S 2023-01-12 First reading: referred to Committee on Education and Career Development",,0dbe7e8570a0f534845bdd63e8cc20fd,,,,,,,,,,,,,,,,,,,,,,,
Indiana,SB0413,Parental rights in education.,Don't Say Gay/Forced Outing,1/19/2023,Senator Doriot added as second author,High,,https://legiscan.com/IN/bill/SB0413/2023,"Gary Byrne, Blake Doriot",,"S 2023-01-19 Authored by Senator Byrne, S 2023-01-19 First reading: referred to Committee on Education and Career Development, S 2023-01-19 Senator Doriot added as second author",,24fc452288e971f93b52c4e68a5f295d,,,,,,,,,,,,,,,,,,,,,,,
Indiana,SB0480,Gender transition procedures for minors.,Gender Affirming Care Ban,2/23/2023,Senator Young M added as coauthor,High,,https://legiscan.com/IN/bill/SB0480/2023,"Tyler Johnson, Ed Charbonneau, Gary Byrne, Stacey Donato, Blake Doriot, Mike Gaskill, James Buck, Aaron Freeman, Jeff Raatz, Andy Zay, Greg Walker, Mark Messmer, Jack Sandlin, Linda Rogers, James Tomes, Rick Niemeyer, Brian Buchanan, Scott Alexander, John Crane, Michael Young",Hearing 2023-02-22 09:00 Senate Chamber,"S 2023-01-19 Authored by Senator Johnson, S 2023-01-19 Coauthored by Senators Byrne, Donato, Doriot, Gaskill, Buck, Ford Jon, Freeman, Raatz, Zay, Walker G, Messmer, Sandlin, Rogers, Tomes, Niemeyer, Buchanan, Alexander, S 2023-01-19 First reading: referred to Committee on Health and Provider Services, S 2023-01-23 Senator Ford Jon removed as coauthor, S 2023-01-30 Senator Crane added as coauthor, S 2023-02-21 Senator Charbonneau added as second author, S 2023-02-23 Committee report: amend do pass, adopted, S 2023-02-23 Senator Young M added as coauthor",Pass Committee,4c9b5c59bd9f8de95da06c446f313c68,,,,,,,,,,,,,,,,,,,,,,,
Indiana,SB0487,Preventing pregnancy in prison.,Prison Placement,1/19/2023,First reading: referred to Committee on Health and Provider Services,High,,https://legiscan.com/IN/bill/SB0487/2023,Stacey Donato,,"S 2023-01-19 Authored by Senator Donato, S 2023-01-19 First reading: referred to Committee on Health and Provider Services",,9ee9a2cafed5f3c87f32da51045e402d,,,,,,,,,,,,,,,,,,,,,,,
Indiana,HB1569,Restrictions on DOC provision of  gender therapy.,Gender Affirming Care Ban,2/15/2023,Referred to the Senate,High,GAC ban for prisoners,https://legiscan.com/IN/bill/HB1569/2023,"Peggy Mayfield, Joanna King, Stacey Donato",Hearing 2023-02-08 10:30 Room 156-C,"H 2023-01-19 Authored by Representative Mayfield, H 2023-01-19 First reading: referred to Committee on Courts and Criminal Code, H 2023-02-06 Representative King J added as coauthor, H 2023-02-09 Committee report: amend do pass, adopted, H 2023-02-13 Second reading: ordered engrossed, H 2023-02-14 Third reading: passed; Roll Call 134: yeas 68, nays 24, H 2023-02-14 Senate sponsor: Senator Donato, H 2023-02-15 Referred to the Senate",Pass One Chamber,9a41d43b182b6106d97f5b6e02f8987b,,,,,,,,,,,,,,,,,,,,,,,
Indiana,HB1589,Malpractice regarding gender therapeutics.,Gender Affirming Care Ban,1/19/2023,First reading: referred to Committee on Public Health,High,Allows Malpractice suits regarding GAC,https://legiscan.com/IN/bill/HB1589/2023,Julie McGuire,,"H 2023-01-19 Authored by Representative McGuire, H 2023-01-19 First reading: referred to Committee on Public Health",,2769ca8c6bb25f9f8743cb403858133f,,,,,,,,,,,,,,,,,,,,,,,
Iowa,HF180,A bill for an act relating to parental and guardian consent and information regarding the gender identity of students enrolled in a school district or charter school.(Formerly HF 9.),Don't Say Gay/Forced Outing,2/1/2023,Placed on calendar. H.J. 226.,High,,https://legiscan.com/IA/bill/HF180/2023,Education,,H 2023-02-01 Placed on calendar. H.J. 226.,,a0aaaffca256271f93ab77b66c080857,,,,,,,,,,,,,,,,,,,,,,,
Iowa,HF180,A bill for an act relating to parental and guardian consent and information regarding the gender identity of students enrolled in a school district or charter school.(Formerly HF 9.),Forced Outing by Schools,2/1/2023,Placed on calendar. H.J. 226.,High,,https://legiscan.com/IA/bill/HF180/2023,Education,,H 2023-02-01 Placed on calendar. H.J. 226.,,a0aaaffca256271f93ab77b66c080857,,,,,,,,,,,,,,,,,,,,,,,
Iowa,HF2,"A bill for an act relating to public contracts, public fund investing, and lending practices with certain companies that engage in economic boycotts based on environmental, social, or governance criteria, and including effective date and applicability provisions.",Anti-Boycotts Act,2/23/2023,Subcommittee recommends amendment and passage. Vote Total: 3-0.,High,Bans state contractors from boycotting companies that don't provide gender affirming care,https://legiscan.com/IA/bill/HF2/2023,"Henry Stone, Steven Holt, Skyler Wheeler, Taylor Collins, Tom Moore, Thomas Jeneary, Mike Vondran, Dean Fisher, Joshua Meggers, Derek Wulf, Jeff Shipley, Steven Bradley, Cindy Golding, Martin Graber, Craig Johnson, Dave Deyoe, Norlin Mommsen, Brooke Boden, Bobby Kaufmann, Joel Fry, Eddie Andrews, Charley Thomson, Robert Henderson, Devon Wood, Heather Hora, Anne Osmundson, Matt Windschitl, Pat Grassley, Jacob Bossman, Thomas Gerhold",Hearing 2023-02-23 13:30 ,"H 2023-01-11 Introduced, referred to State Government. H.J. 56., H 2023-02-20 Subcommittee: Lundgren, Cooling, Dunwell, Nielsen and Wills, J. H.J. 380., H 2023-02-22 Subcommittee Meeting: 02/23/2023 1:30PM House Lounge., H 2023-02-23 Subcommittee recommends amendment and passage. Vote Total: 3-0.",Pass Committee,8c7b228b923803c948d9a3b42c6f24cb,,,,,,,,,,,,,,,,,,,,,,,
Iowa,HF8,A bill for an act prohibiting instruction related to gender identity and sexual orientation in school districts and charter schools in kindergarten through grade three.(See HF 348.),Don't Say Gay/Forced Outing,2/20/2023,"Committee report approving bill, renumbered as HF 348.",High,,https://legiscan.com/IA/bill/HF8/2023,"Skyler Wheeler, Steven Holt, Henry Stone, Norlin Mommsen, Taylor Collins, Dean Fisher, Bill Gustoff, Thomas Jeneary, Mike Vondran, Derek Wulf, Steven Bradley, Joshua Meggers, Barb Kniff McCulla, Cindy Golding, Dave Deyoe, Martin Graber, Phil Thompson, John Wills, Stan Gustafson, Craig Johnson, Brooke Boden, Austin Harris, Bobby Kaufmann, Joel Fry, Carter Nordman, David Young, Robert Henderson, Heather Hora, Devon Wood, Anne Osmundson, Matt Windschitl, Pat Grassley, Thomas Gerhold","Hearing 2023-02-08 12:30 , Hearing 2023-02-13 12:30 ","H 2023-01-11 Introduced, referred to Education. H.J. 58., H 2023-01-12 Subcommittee: Wheeler, Holt and Steckman. H.J. 95., H 2023-02-07 Subcommittee Meeting: 02/08/2023 12:30PM RM 19 (Cancelled)., H 2023-02-09 Subcommittee Meeting: 02/13/2023 12:30PM RM 19., H 2023-02-14 Subcommittee recommends passage. Vote Total: 2-0., H 2023-02-15 Committee report, recommending amendment and passage. H.J. 365., H 2023-02-20 Committee report approving bill, renumbered as HF 348.",Pass Committee,e7118ac15714b5b54dcef4238308e894,,,,,,,,,,,,,,,,,,,,,,,
Iowa,SF110,"A bill for an act relating to gender-transition procedures, and including effective date provisions.",Gender Affirming Care Ban,1/24/2023,"Subcommittee: Rowley, Evans, and Quirmbach. S.J. 178.",High,,https://legiscan.com/IA/bill/SF110/2023,"Sandy Salmon, Lynn Evans, Kevin Alons, Jesse Green, Cherielynn Westrich, Jeff Taylor, Dennis Guth, Rocky De Witt, Dave Rowley",,"S 2023-01-23 Introduced, referred to Judiciary. S.J. 167., S 2023-01-24 Subcommittee: Rowley, Evans, and Quirmbach. S.J. 178.",,881c35c3cb95d49b88876fc761faf97b,,,,,,,,,,,,,,,,,,,,,,,
Iowa,SF129,"A bill for an act relating to actions relative to treatment or intervention regarding the discordance between a minor's sex and gender identity, and providing civil penalties.",Gender Affirming Care Ban,1/31/2023,"Subcommittee: Edler, Petersen, and Salmon. S.J. 217.",High,under 18. legalizes conversion therapy,https://legiscan.com/IA/bill/SF129/2023,Sandy Salmon,,"S 2023-01-25 Introduced, referred to Health and Human Services. S.J. 182., S 2023-01-31 Subcommittee: Edler, Petersen, and Salmon. S.J. 217.",,73fc8eb272ca2469567f13fb1a4ee358,,,,,,,,,,,,,,,,,,,,,,,
Iowa,SF159,"A bill for an act relating to education, including modifying the responsibilities of the state board of education and school districts, prohibiting instruction related to gender identity or sexual orientation in school districts and charter schools in kindergarten through grade eight, modifying provisions associated with the human growth and development instruction and health screenings provided in school districts, charter schools, and innovation zone schools, and providing civil penalties.",Don't Say Gay/Forced Outing,2/9/2023,Subcommittee recommends passage. [].,High,,https://legiscan.com/IA/bill/SF159/2023,Sandy Salmon,Hearing 2023-02-09 12:00 ,"S 2023-01-26 Introduced, referred to Education. S.J. 194., S 2023-02-01 Subcommittee: Salmon, Evans, and Quirmbach. S.J. 231., S 2023-02-08 Subcommittee Meeting: 02/09/2023 12:00PM Room G15., S 2023-02-09 Subcommittee recommends passage. [].",Pass Committee,ea6c4646c62a1f0a8352690edc6e8a5c,,,,,,,,,,,,,,,,,,,,,,,
Iowa,SF83,"A bill for an act relating to instruction relating to gender identity in the curriculum provided to students enrolled in kindergarten through grade eight in school districts, accredited nonpublic schools, and charter schools and creating a private cause of action.",Don't Say Gay/Forced Outing,1/31/2023,Subcommittee recommends passage. [].,High,Don't say gay bill that only bans discussions on gender identity and provides a private right of action,https://legiscan.com/IA/bill/SF83/2023,"Jeff Taylor, Dennis Guth, Mark Lofgren, Julian Garrett, Cherielynn Westrich, Dave Rowley, Brad Zaun, Sandy Salmon, Ken Rozenboom, Jesse Green, Lynn Evans, Rocky De Witt, Kevin Alons, Annette Sweeney, Jeff Reichman, Chris Cournoyer",Hearing 2023-01-31 12:00 ,"S 2023-01-17 Introduced, referred to Education. S.J. 139., S 2023-01-24 Subcommittee: J. Taylor, Quirmbach, and Westrich. S.J. 177., S 2023-01-30 Subcommittee Meeting: 01/31/2023 12:00PM Room G15., S 2023-01-31 Subcommittee recommends passage. [].",Pass Committee,dc2c2764bd066b580df91777921041aa,,,,,,,,,,,,,,,,,,,,,,,
Iowa,SF335,A bill for an act prohibiting persons from entering single and multiple occupancy toilet facilities and other facilities in elementary and secondary schools that do not correspond with the person's biological sex and including effective date provisions.,Trans Bathroom Ban,2/22/2023,"Subcommittee: Westrich, Celsi, and Gruenhagen. S.J. 394.",High,In schools,https://legiscan.com/IA/bill/SF335/2023,Cherielynn Westrich,,"S 2023-02-20 Introduced, referred to Education. S.J. 358., S 2023-02-22 Subcommittee: Westrich, Celsi, and Gruenhagen. S.J. 394.",,b09c5dd7cce8d3d1ef9ab7931f7fa319,,,,,,,,,,,,,,,,,,,,,,,
Iowa,SF348,"A bill for an act relating to minors present at drag shows, and providing penalties.",Drag Ban,2/21/2023,"Subcommittee: Schultz, Evans, and Quirmbach. S.J. 372.",High,Could jail parents for having their kids see drag,https://legiscan.com/IA/bill/SF348/2023,Sandy Salmon,,"S 2023-02-21 Introduced, referred to Judiciary. S.J. 367., S 2023-02-21 Subcommittee: Schultz, Evans, and Quirmbach. S.J. 372.",,b3befc12398f2a3d2f634031b4d5f9d1,,,,,,,,,,,,,,,,,,,,,,,
Iowa,HF290,"A bill for an act relating to the terms gender and sex, including a person's sex designation listed on government documents.",Documentation Change Ban,2/14/2023,"Introduced, referred to State Government. H.J. 306.",High,,https://legiscan.com/IA/bill/HF290/2023,Dean Fisher,,"H 2023-02-14 Introduced, referred to State Government. H.J. 306.",,0fc8dcfb82a472aef0efce6210332559,,,,,,,,,,,,,,,,,,,,,,,
Iowa,HF325,A bill for an act relating to gender identity and sex under the Iowa civil rights Act.,Defining Trans People Out of the Law,2/15/2023,"Introduced, referred to Judiciary. H.J. 354.",High,"Defines trans kids out of law, allows for discremination agianst trans people",https://legiscan.com/IA/bill/HF325/2023,Jeff Shipley,,"H 2023-02-15 Introduced, referred to Judiciary. H.J. 354.",,e56d5de3d4ae7ee20490df6dfbc278e8,,,,,,,,,,,,,,,,,,,,,,,
Kansas,HB2238,Creating the fairness in women's sports act to require that female student athletic teams only include members who are biologically female.,Trans Sports Ban,2/23/2023,House Final Action - Passed;  Yea: 82 Nay: 40,Moderate,,https://legiscan.com/KS/bill/HB2238/2023,Education,Hearing 2023-02-13 13:30 Room 218-N,"H 2023-01-31 House Introduced, H 2023-01-31 House Referred to Committee on Education, H 2023-02-13 House Hearing: Monday, February 13, 2023, 1:30 PM Room 218-N, H 2023-02-16 House Committee Report recommending bill be passed by Committee on Education, H 2023-02-22 House Committee of the Whole - Be passed, H 2023-02-23 House Final Action - Passed;  Yea: 82 Nay: 40",Pass One Chamber,fe8b2df671434a36aa1f67911ef6e934,,,,,,,,,,,,,,,,,,,,,,,
Kansas,HB2404,"Enacting the Kansas protection of pensions and businesses against ideological interference act, relating to ideological boycotts involving environmental, social or governance standards, requiring KPERS to divest from and prohibiting state contracts or the deposit of state moneys with entities engaged in such boycotts as determined by the state treasurer and prohibiting discriminatory practices in the financial services industry based on such boycotts.",Anti-Boycotts Act,2/10/2023,House Referred to Committee on Federal and State Affairs,Moderate,,https://legiscan.com/KS/bill/HB2404/2023,Federal and State Affairs,,"H 2023-02-10 House Introduced, H 2023-02-10 House Referred to Committee on Federal and State Affairs",,5e2241cd3fac86ddc4d5cab54d9657c1,,,,,,,,,,,,,,,,,,,,,,,
Kansas,HB2427,Requiring school districts to provide separate accommodations for students of each biological sex on overnight school sponsored trips.,Legal Discrimination In Education,2/16/2023,House Referred to Committee on Education,Moderate,,https://legiscan.com/KS/bill/HB2427/2023,Federal and State Affairs,,"H 2023-02-16 House Introduced, H 2023-02-16 House Referred to Committee on Education",,0da0e5a05c035901636d59aa10092305,,,,,,,,,,,,,,,,,,,,,,,
Kansas,SB12,Enacting the Kansas child mutilation prevention act to criminalize performing gender reassignment surgery or prescription of hormone replacement therapy on certain persons and providing grounds for unprofessional conduct for healing arts licensees.,Gender Affirming Care Ban,2/14/2023,"Senate Hearing: Tuesday, February 14, 2023, 8:30 AM Room 142-S",Moderate,Felony ban up to 21. ,https://legiscan.com/KS/bill/SB12/2023,"Mike Thompson, Mark Steffen",Hearing 2023-02-14 08:30 Room 142-S,"S 2023-01-09 Senate Prefiled for Introduction on Thursday, January 5, 2023, S 2023-01-09 Senate Introduced, S 2023-01-10 Senate Referred to Committee on Judiciary, S 2023-01-11 Senate Withdrawn from Committee on Judiciary, S 2023-01-11 Senate Referred separately to Committee on Public Health and Welfare and Committee on Judiciary, S 2023-02-14 Senate Hearing: Tuesday, February 14, 2023, 8:30 AM Room 142-S",,a418fa7c3812cc7807ed4893208a141e,,,,,,,,,,,,,,,,,,,,,,,
Kansas,SB149,Expanding the crime of promoting obscenity to minors to include drag performances.,Drag Ban,2/3/2023,Senate Referred to Committee on Judiciary,Moderate,,https://legiscan.com/KS/bill/SB149/2023,Federal and State Affairs,,"S 2023-02-02 Senate Introduced, S 2023-02-03 Senate Referred to Committee on Judiciary",,13cd66aaec1959f91333d792a2943117,,,,,,,,,,,,,,,,,,,,,,,
Kansas,SB180,Establishing the women's bill of rights to provide a meaning of biological sex for purposes of statutory construction.,Defining Trans People Out of the Law,2/23/2023,Senate Final Action - Passed;  Yea: 26 Nay: 10,Moderate,,https://legiscan.com/KS/bill/SB180/2023,Public Health and Welfare,Hearing 2023-02-15 08:30 Room 142-S,"S 2023-02-07 Senate Introduced, S 2023-02-08 Senate Referred to Committee on Public Health and Welfare, S 2023-02-15 Senate Hearing: Wednesday, February 15, 2023, 8:30 AM Room 142-S, S 2023-02-20 Senate Committee Report recommending bill be passed by Committee on Public Health and Welfare, S 2023-02-22 Senate Committee of the Whole - Be passed, S 2023-02-23 Senate Final Action - Passed;  Yea: 26 Nay: 10",Pass One Chamber,fe2104c0f059a44f052a019b3995873b,,,,,,,,,,,,,,,,,,,,,,,
Kansas,SB201,Prohibiting the expenditure of state moneys for the production or performance of drag shows for which minors are the primary audience.,Drag Ban,2/8/2023,Senate Referred to Committee on Judiciary,Moderate,,https://legiscan.com/KS/bill/SB201/2023,Federal and State Affairs,,"S 2023-02-07 Senate Introduced, S 2023-02-08 Senate Referred to Committee on Judiciary",,f9f8c1077f56b0f2961e46a6d23717e2,,,,,,,,,,,,,,,,,,,,,,,
Kansas,SB207,Requiring policies for and establishing restrictions on school districts with regard to the use of an individual's pronouns if such pronouns differ from the individual's biological sex.,Forced Misgendering,2/9/2023,Senate Referred to Committee on Education,Moderate,,https://legiscan.com/KS/bill/SB207/2023,Education,,"S 2023-02-08 Senate Introduced, S 2023-02-09 Senate Referred to Committee on Education",,7752ac831ae9e67a98f4d023a1a6da11,,,,,,,,,,,,,,,,,,,,,,,
Kansas,SB224,"Enacting the Kansas protection of pensions and businesses against ideological interference act, relating to ideological boycotts involving environmental, social or governance standards, requiring KPERS to divest from and prohibiting state contracts or the deposit of state moneys with entities engaged in such boycotts as determined by the state treasurer and prohibiting discriminatory practices in the financial services industry based on such boycotts.",Anti-Boycotts Act,2/10/2023,Senate Referred to Committee on Federal and State Affairs,Moderate,,https://legiscan.com/KS/bill/SB224/2023,Federal and State Affairs,,"S 2023-02-09 Senate Introduced, S 2023-02-10 Senate Referred to Committee on Federal and State Affairs",,f4dbc4f698a8bac299d98371f41d1006,,,,,,,,,,,,,,,,,,,,,,,
Kansas,SB233,Creating a civil cause of action against a physician who performs childhood gender reassignment service and requiring revocation of a physician's license who performs childhood gender reassignment service.,Gender Affirming Care Ban,2/23/2023,Senate Final Action - Passed;  Yea: 26 Nay: 11,Moderate,,https://legiscan.com/KS/bill/SB233/2023,Federal and State Affairs,Hearing 2023-02-14 08:30 Room Room Change to 546,"S 2023-02-10 Senate Introduced, S 2023-02-13 Senate Referred to Committee on Public Health and Welfare, S 2023-02-14 Senate Hearing: Tuesday, February 14, 2023, 8:30 AM Room Room Change to 546, S 2023-02-20 Senate Committee Report recommending bill be passed by Committee on Public Health and Welfare, S 2023-02-22 Senate Committee of the Whole - Be passed, S 2023-02-23 Senate Final Action - Passed;  Yea: 26 Nay: 11",Pass One Chamber,e56a26d7c6d72aa267c8aac17d38b785,,,,,,,,,,,,,,,,,,,,,,,
Kansas,SB255,Requiring school districts to provide separate accommodations for students of each biological sex on overnight school sponsored trips.,Legal Discrimination In Education,2/16/2023,Senate Referred to Committee on Education,Moderate,,https://legiscan.com/KS/bill/SB255/2023,Federal and State Affairs,,"S 2023-02-15 Senate Introduced, S 2023-02-16 Senate Referred to Committee on Education",,55a0a6e25cdefcdd6a631abb149ed7bf,,,,,,,,,,,,,,,,,,,,,,,
Kansas,HB2436,"Enacting the Kansas public investments and contracts protection act concerning environmental, social and governance (ESG) criteria, prohibiting the state and political subdivisions from giving preferential treatment to or discriminating against companies based on such ESG criteria in procuring or letting contracts, requiring KPERS fiduciaries to act solely in the financial interest of the participants and beneficiaries of the system, restricting state agencies from adopting ESG criteria or requiring any person or business to operate in accordance with such criteria and providing for enforcement of such act by the attorney general.",Anti-Boycotts Act,2/22/2023,House Referred to Committee on Financial Institutions and Pensions,Moderate,,https://legiscan.com/KS/bill/HB2436/2023,Appropriations,,"H 2023-02-22 House Introduced, H 2023-02-22 House Referred to Committee on Financial Institutions and Pensions",,c6c73acfcea27618a627b90188a16b46,,,,,,,,,,,,,,,,,,,,,,,
Kentucky,HB120,AN ACT relating to children's health.,Gender Affirming Care Ban,1/5/2023,to Committee on Committees (H),High,Safe act. ,https://legiscan.com/KY/bill/HB120/2023,"Savannah Maddox, Felicia Rabourn, Ryan Dotson",,"H 2023-01-05 introduced in House, H 2023-01-05 to Committee on Committees (H)",,abbff23d94c7c9443a2abeae2d4c4fbc,,,,,,,,,,,,,,,,,,,,,,,
Kentucky,HB173,AN ACT relating to education.,Trans Bathroom Ban,2/7/2023,to Committee on Committees (H),High,school Bathroom ban + school drag ban + pride flag ban + don't say gay + forced outing,https://legiscan.com/KY/bill/HB173/2023,"Josh Calloway, Candy Massaroni, Shane Baker, Emily Callaway, Jennifer Henson Decker, Steven Doan, Ryan Dotson, Chris Fugate, David Hale, Mark Hart, John Hodgson, Thomas Huff, Matt Lockett, Marianne Proctor, Steve Rawlings, Nancy Tate, Walker Thomas, Billy Wesley, Susan Tyler Witten",,"H 2023-02-07 introduced in House, H 2023-02-07 to Committee on Committees (H)",,7a452cfbaea41a0001af2938f08f8b8b,,,,,,,,,,,,,,,,,,,,,,,
Kentucky,HB177,AN ACT relating to children and declaring an emergency.,Don't Say Gay/Forced Outing,2/23/2023,to Judiciary (H),High,immedietly in effect. EMERGENCY decleration,https://legiscan.com/KY/bill/HB177/2023,"Shane Baker, Jennifer Henson Decker, Danny Bentley, Steve Bratcher, Randy Bridges, Emily Callaway, Josh Calloway, Steven Doan, Myron Dossett, Ryan Dotson, Daniel Fister, Patrick Flannery, Deanna Frazier Gordon, Chris Freeland, Chris Fugate, Jim Gooch, David Hale, Mark Hart, Richard Heath, John Hodgson, Thomas Huff, Mary Imes, DJ Johnson, Jacob Justice, Matt Lockett, Savannah Maddox, Candy Massaroni, Bobby McCool, Shawn McPherson, Amy Neighbors, Jason Petrie, Michael Pollock, Marianne Proctor, Steve Rawlings, Rebecca Raymer, William Reed, Scott Sharp, Tom Smith, Nancy Tate, Walker Thomas, Timmy Truett, Russell Webber, Billy Wesley, Richard White, Wade Williams, Susan Tyler Witten",,"H 2023-02-07 introduced in House, H 2023-02-07 to Committee on Committees (H), H 2023-02-21 floor amendment (1) filed, H 2023-02-23 to Judiciary (H)",,28cd9c615558c4c610ea24373d5f9b82,,,,,,,,,,,,,,,,,,,,,,,
Kentucky,HB30,AN ACT relating to public school facilities and declaring an emergency.,Trans Bathroom Ban,1/3/2023,to Committee on Committees (H),High,School bathroom ban; EMERGENCY legislation. ,https://legiscan.com/KY/bill/HB30/2023,"Billy Wesley, Shane Baker, Danny Bentley, Randy Bridges, Josh Calloway, Jennifer Henson Decker, Steven Doan, Ryan Dotson, Daniel Fister, Chris Freeland, Chris Fugate, Jim Gooch, David Hale, Richard Heath, John Hodgson, Thomas Huff, Kevin Jackson, DJ Johnson, Candy Massaroni, Bobby McCool, Shawn McPherson, Jason Petrie, Michael Pollock, Marianne Proctor, Steve Rawlings, William Reed, Scott Sharp, Tom Smith, Nancy Tate, Walker Thomas, James Tipton, Timmy Truett, Russell Webber, Richard White, Wade Williams",,"H 2023-01-03 introduced in House, H 2023-01-03 to Committee on Committees (H)",,ece470d9dec56bb50c5988c8098dfe7b,,,,,,,,,,,,,,,,,,,,,,,
Kentucky,HB58,AN ACT relating to protecting the exercise of medical ethics within the medical profession.,Legal Discrimination in Healthcare,1/3/2023,to Committee on Committees (H),High,,https://legiscan.com/KY/bill/HB58/2023,"Steve Rawlings, Josh Calloway, John Hodgson, Savannah Maddox, Marianne Proctor, Nancy Tate, Billy Wesley",,"H 2023-01-03 introduced in House, H 2023-01-03 to Committee on Committees (H)",,fc46d01920c4d1ade5bc1ac576cd01e9,0,,,,,,,,,,,,,,,,,,,,,,0
Kentucky,SB102,AN ACT relating to education.,Trans Bathroom Ban,2/10/2023,to Education (S),High,school Bathroom ban + school drag ban + pride flag ban + don't say gay + forced outing,https://legiscan.com/KY/bill/SB102/2023,"Lindsey Tichenor, Shelley Frommeyer, Gary Boswell, Rick Girdler, Robert Mills, Adrienne Southworth, Johnnie Turner, Gex Williams",,"S 2023-02-08 introduced in Senate, S 2023-02-08 to Committee on Committees (S), S 2023-02-10 to Education (S)",,42d453948958e40957f33dfe9f2b0032,,,,,,,,,,,,,,,,,,,,,,,
Kentucky,SB115,AN ACT relating to adult-oriented businesses.,Drag Ban,2/14/2023,"to Veterans, Military Affairs, & Public Protection (S)",High,Civil liabilty to businesses,https://legiscan.com/KY/bill/SB115/2023,"Lindsey Tichenor, Gex Williams, Gary Boswell, Adrienne Southworth, Phillip Wheeler, Mike Wilson",,"S 2023-02-10 introduced in Senate, S 2023-02-10 to Committee on Committees (S), S 2023-02-14 to Veterans, Military Affairs, & Public Protection (S)",,d71b818465ebbdd9535401f592ff0804,,,,,,,,,,,,,,,,,,,,,,,
Kentucky,SB150,AN ACT relating to rights in public schools.,Forced Outing by Schools,2/17/2023,floor amendment (1) filed,High,,https://legiscan.com/KY/bill/SB150/2023,"George Wise, Gary Boswell, Danny Carroll, Shelley Frommeyer, Rick Girdler, Stephen Meredith, Robert Mills, John Schickel, Brandon Storm, Lindsey Tichenor, Phillip Wheeler, Gex Williams, Mike Wilson","Hearing 2023-02-09 11:00 Annex Room 131, Hearing 2023-02-16 11:00 Annex Room 131","S 2023-02-08 introduced in Senate, S 2023-02-08 to Committee on Committees (S), S 2023-02-08 to Education (S), S 2023-02-09 reported favorably, 1st reading, to Calendar, S 2023-02-09 floor amendments (1), (2), (3) and (4) filed, S 2023-02-10 2nd reading, to Rules, S 2023-02-10 floor amendments (5) and (6) filed, S 2023-02-15 recommitted to Education (S), S 2023-02-16 reported favorably, to Rules with Committee Substitute (1), S 2023-02-16 posted for passage in the Regular Orders of the Day for Thursday, February 16, 2023, S 2023-02-16 3rd reading, S 2023-02-16 floor amendments (1), (2), (3), (4), (5) and (6) ruled out of order, S 2023-02-16 passed 29-6 with Committee Substitute (1), S 2023-02-16 floor amendment (7) filed to Committee Substitute, H 2023-02-17 received in House, H 2023-02-17 to Committee on Committees (H), H 2023-02-17 floor amendment (1) filed",Pass One Chamber,909f392234400ba14c30d2b655ee5a3c,,,,,,,,,,,,,,,,,,,,,,,
Kentucky,HB470,AN ACT relating to the protection of children.,Gender Affirming Care Ban,2/21/2023,to Judiciary (H),High,"Not on. Legiscan, but on Kentucky's website. It is every anti-trans bill rolled into one. https://apps.legislature.ky.gov/record/23rs/hb470.html",https://legiscan.com/KY/bill/HB470/2023,"Jennifer Henson Decker, James Tipton, Shane Baker, Steve Bratcher, Randy Bridges, Josh Calloway, Ryan Dotson, Daniel Elliott, Daniel Fister, Patrick Flannery, Deanna Frazier Gordon, Chris Fugate, Jim Gooch, David Hale, Richard Heath, John Hodgson, Mary Imes, DJ Johnson, Kim King, Matt Lockett, Candy Massaroni, Bobby McCool, Shawn McPherson, Amy Neighbors, Jason Petrie, Marianne Proctor, Steve Rawlings, Rebecca Raymer, William Reed, Steven Rudy, Scott Sharp, Nancy Tate, Walker Thomas, Timmy Truett, Ken Upchurch, Russell Webber, Wade Williams",,"H 2023-02-21 introduced in House, H 2023-02-21 to Committee on Committees (H), H 2023-02-21 taken from Committee on Committees (H), H 2023-02-21 1st reading, H 2023-02-21 to Judiciary (H)",,5398598b7fc47ae7ea5fac64c29ef640,,,,,,,,,,,,,,,,,,,,,,,
Kentucky,HB585,AN ACT relating to birth certificates.,Birth Certificate Change Ban,2/22/2023,to Committee on Committees (H),High,,https://legiscan.com/KY/bill/HB585/2023,Billy Wesley,,"H 2023-02-22 introduced in House, H 2023-02-22 to Committee on Committees (H)",,6a38add012ca42ca375b55c57124f7e3,,,,,,,,,,,,,,,,,,,,,,,
Maryland,HB359,Education  Interscholastic and Intramural Junior Varsity and Varsity Teams and Sports  Designation Based on Sex (Save Womens Sports Act),Trans Sports Ban,2/20/2023,Unfavorable Report by Ways and Means,Low,,https://legiscan.com/MD/bill/HB359/2023,"Kathy Szeliga, Christopher Adams, Steven Arentz, Lauren Arikan, Terry Baker, Christopher Bouchat, Jason Buckel, Brian Chisholm, Barrie Ciliberti, Mark Fisher, Jeff Ghrist, Robin Grammer, Michael Griffith, Wayne Hartman, Jim Hinebaugh, Kevin Hornberger, Jay Jacobs, Nicholaus Kipke, Bob Long, Nino Mangione, Susan McComas, Ric Metzgar, April Fleming Miller, Matt Morgan, Todd Morgan, Ryan Nawrocki, Charles Otto, Teresa Reilly, April Rose, Stuart Schmidt, Chris Tomlinson, William Valentine, William Wivell",Hearing 2023-02-15 13:00 ,"H 2023-01-26 First Reading Ways and Means, H 2023-02-01 Hearing 2/15 at 1:00 p.m., H 2023-02-20 Unfavorable Report by Ways and Means",,c8ec189d72e690f189c956832746551e,,,,,,,,,,,,,,,,,,,,,,,
Minnesota,HF1903,"Drag performances classified as adult entertainment, and location restrictions of an adult entertainment establishment expanded.",Drag Ban,2/16/2023,"Introduction and first reading, referred to Public Safety Finance and Policy",Low,,https://legiscan.com/MN/bill/HF1903/2023,Walter Hudson,,"H 2023-02-16 Introduction and first reading, referred to Public Safety Finance and Policy",,9775f5d1fcb921f3bd22e76071473884,,,,,,,,,,,,,,,,,,,,,,,
Minnesota,SF311,Student physical privacy establishment,Trans Bathroom Ban,1/23/2023,Author added Lucero,Low,,https://legiscan.com/MN/bill/SF311/2023,"Glenn Gruenhagen, Steve Green, Eric Lucero",,"S 2023-01-17 Introduction and first reading, S 2023-01-17 Referred to Education Policy, S 2023-01-23 Author added Lucero",,ec546a450104ef76837f1b00ed5cdfe0,,,,,,,,,,,,,,,,,,,,,,,
Minnesota,SF933,Drag performances as adult entertainment classification; location restrictions on adult entertainment establishment,Drag Ban,2/9/2023,Author added Gruenhagen,Low,,https://legiscan.com/MN/bill/SF933/2023,"Eric Lucero, Jeff Howe, Glenn Gruenhagen",,"S 2023-01-30 Introduction and first reading, S 2023-01-30 Referred to Judiciary and Public Safety, S 2023-02-02 Author added Howe, S 2023-02-09 Author added Gruenhagen",,cc08b3ebe0c30859696b9cde32f92477,,,,,,,,,,,,,,,,,,,,,,,
Mississippi,HB1074,The Title IX Preservation Act; enact.,Forced Misgendering,1/31/2023,Died In Committee,High,Allows schools to enforce gendered dress codes,https://legiscan.com/MS/bill/HB1074/2023,Jill Ford,,"H 2023-01-16 Referred To Judiciary A, H 2023-01-31 Died In Committee",Failed,be418498460347ac81f1d22876d90633,,,,,,,,,,,,,,,,,,,,,,,
Mississippi,HB1099,Public retirement systems; require all investment actions to be made exclusively for purpose of providing financial benefits for members of.,Ban on Public Investment in ESG Funds,1/31/2023,Died In Committee,High,Bans public money from investing in funds that don't invest in companies that fail to provide gender affirming care,https://legiscan.com/MS/bill/HB1099/2023,Dana Criswell,,"H 2023-01-16 Referred To Appropriations, H 2023-01-31 Died In Committee",Failed,5475100c73bb84b2871fcd7f55620163,,,,,,,,,,,,,,,,,,,,,,,
Mississippi,HB1124,Gender reassignment surgery or services; prohibit performing or paying for.,Gender Affirming Care Ban,1/31/2023,Died In Committee,High,,https://legiscan.com/MS/bill/HB1124/2023,Jill Ford,,"H 2023-01-16 Referred To Public Health and Human Services, H 2023-01-31 Died In Committee",Failed,cde2f552a00a2ee36b5a8c8c551487f6,,,,,,,,,,,,,,,,,,,,,,,
Mississippi,HB1125,Regulate Experimental Adolescent Procedures (REAP) Act; create to regulate transgender procedures and surgeries.,Gender Affirming Care Ban,2/23/2023,Due From Governor 03/01/23,High,18 and under ban,https://legiscan.com/MS/bill/HB1125/2023,"Gene Newman, Philip Gunn, Dan Eubanks, Mark Tullos, Chris Brown, Brady Williamson, Steve Hopkins, William Arnold, Bill Kinkade, Jill Ford, Nick Bain, Randall Patterson",,"H 2023-01-16 Referred To Public Health and Human Services, H 2023-01-19 Title Suff Do Pass, H 2023-01-19 Point of Order Raised, H 2023-01-19 Point of Order - Well Taken, H 2023-01-19 Passed, H 2023-01-20 Transmitted To Senate, S 2023-01-27 Referred To Judiciary, Division B, S 2023-01-31 Title Suff Do Pass, S 2023-02-21 Amendment Failed, S 2023-02-21 Passed, S 2023-02-22 Returned For Enrolling, H 2023-02-23 Enrolled Bill Signed",Pass Both Chambers,bafcec703970ff0ffbf1c386bd77c522,,,,,,,,,,,,,,,,,,,,,,,
Mississippi,HB1126,Transgender procedures; restrict for persons under age 21.,Gender Affirming Care Ban,1/31/2023,Died In Committee,High,Felony ban under 21. Child abuse for any GAC,https://legiscan.com/MS/bill/HB1126/2023,John Lamar,,"H 2023-01-16 Referred To Public Health and Human Services, H 2023-01-31 Died In Committee",Failed,0676daebf0822b6d37627d6ca4b239fc,,,,,,,,,,,,,,,,,,,,,,,
Mississippi,HB1127,MS Safe Adolescents from Experimentation (SAFE); create to prohibit providing gender transition procedures to minors.,Gender Affirming Care Ban,1/31/2023,Died In Committee,High,,https://legiscan.com/MS/bill/HB1127/2023,"Becky Currie, William Arnold, Randy Boyd, Billy Calvert, Lester Carpenter, Sam Creekmore, Jerry Darnell, Kevin Ford, Jeff Hale, Jon Lancaster, Vince Mangold, Ken Morgan, Bill Pigott, Fred Shanks, Jerry Turner, Price Wallace, Brady Williamson",,"H 2023-01-16 Referred To Public Health and Human Services, H 2023-01-31 Died In Committee",Failed,5f9f11f413023644f7046ed66f4e9f43,,,,,,,,,,,,,,,,,,,,,,,
Mississippi,HB1144,Title IX Preservation Act; create.,Defining Trans People Out of the Law,1/31/2023,Died In Committee,High,Requires use of biological sex for state records,https://legiscan.com/MS/bill/HB1144/2023,Stacey Hobgood-Wilkes,,"H 2023-01-16 Referred To Judiciary A, H 2023-01-31 Died In Committee",Failed,7585f7afa04361a9ff968aa76bf0ea33,,,,,,,,,,,,,,,,,,,,,,,
Mississippi,HB1258,Gender Transition Procedures; prohibit for persons under age twenty-one.,Gender Affirming Care Ban,1/31/2023,Died In Committee,High,Felony ban under 21. Child abuse for any GAC,https://legiscan.com/MS/bill/HB1258/2023,Dan Eubanks,,"H 2023-01-16 Referred To Public Health and Human Services, H 2023-01-31 Died In Committee",Failed,d788a9b26cdcb60a32f28c1df79578ac,,,,,,,,,,,,,,,,,,,,,,,
Mississippi,HB1476,"""Families' Rights and Responsibilites Act of 2023""; enact.",Don't Say Gay/Forced Outing,1/31/2023,Died In Committee,High,,https://legiscan.com/MS/bill/HB1476/2023,Stacey Hobgood-Wilkes,,"H 2023-01-16 Referred To Judiciary B, H 2023-01-31 Died In Committee",Failed,e772c8d6e0b01e0c1c7b72f87ce57180,,,,,,,,,,,,,,,,,,,,,,,
Mississippi,HB1480,"""Parents' Bill of Rights Act of 2023""; enact.",Don't Say Gay/Forced Outing,1/31/2023,Died In Committee,High,,https://legiscan.com/MS/bill/HB1480/2023,Fred Shanks,,"H 2023-01-16 Referred To Judiciary B, H 2023-01-31 Died In Committee",Failed,ac1659e33819f193698143914b3cf269,,,,,,,,,,,,,,,,,,,,,,,
Mississippi,HB1489,"""Families' Rights and Responsibilities Act of 2023""; enact.",Don't Say Gay/Forced Outing,1/31/2023,Died In Committee,High,,https://legiscan.com/MS/bill/HB1489/2023,Philip Gunn,,"H 2023-01-16 Referred To Judiciary B, H 2023-01-31 Died In Committee",Failed,054a6cf0b1c825a21e755cce2beaf910,,,,,,,,,,,,,,,,,,,,,,,
Mississippi,HB456,Child abuse; revise definition to include gender reassignment.,Gender Affirming Care Ban,1/31/2023,Died In Committee,High,,https://legiscan.com/MS/bill/HB456/2023,"Steve Massengill, Brady Williamson, Jon Lancaster",,"H 2023-01-12 Referred To Judiciary B, H 2023-01-31 Died In Committee",Failed,6b48d145de402e35768fa5e7b62d085b,,,,,,,,,,,,,,,,,,,,,,,
Mississippi,HB509,"""Families' Rights and Responsiblities Act of 2023""; enact.",Don't Say Gay/Forced Outing,1/31/2023,Died In Committee,High,,https://legiscan.com/MS/bill/HB509/2023,Jill Ford,,"H 2023-01-13 Referred To Judiciary A, H 2023-01-31 Died In Committee",Failed,45b8b9a5756bbc4054820180ae0cac64,,,,,,,,,,,,,,,,,,,,,,,
Mississippi,HB576,Gender reassignment surgery or services; prohibit performing or paying for.,Gender Affirming Care Ban,1/31/2023,Died In Committee,High,Uses abortion laws to ban gender affirming care,https://legiscan.com/MS/bill/HB576/2023,"Stacey Hobgood-Wilkes, Brady Williamson",,"H 2023-01-16 Referred To Public Health and Human Services, H 2023-01-31 Died In Committee",Failed,610c554b82e07236bede6d0f0263edcf,,,,,,,,,,,,,,,,,,,,,,,
Mississippi,SB2076,The Title IX Preservation Act; enact.,Defining Trans People Out of the Law,1/31/2023,Died In Committee,High,Biological sex = sex in all state law. ,https://legiscan.com/MS/bill/SB2076/2023,Angela Burks Hill,,"S 2023-01-09 Referred To Judiciary, Division A;Education, S 2023-01-31 Died In Committee",Failed,281d643aaedacc77a73273550af480a1,,,,,,,,,,,,,,,,,,,,,,,
Mississippi,SB2760,Mississippi Help Not Harm Act; enact.,Gender Affirming Care Ban,1/31/2023,Died In Committee,High,,https://legiscan.com/MS/bill/SB2760/2023,"Angela Burks Hill, Scott DeLano, Jeff Tate, Joseph Seymour, Neil Whaley, Kathy Chism, Charles Younger, Joey Fillingane, Chris Caughman, Philip Moran, Tyler McCaughn, Benjamin Suber, Jason Barrett, Jennifer Branning, Joel Carter, Michael McLendon, Bart Williams, Jeremy England, Lydia Chassaniol, Dennis DeBar, Mike Thompson, Walter Michel, Melanie Sojourner, Chris McDaniel, Kevin Blackwell",,"S 2023-01-16 Referred To Judiciary, Division A, S 2023-01-31 Died In Committee",Failed,3e506edbcdd154f9d59c41bc131ab4d0,,,,,,,,,,,,,,,,,,,,,,,
Mississippi,SB2763,Families' Rights and Responsibilities Act; enact.,Don't Say Gay/Forced Outing,1/31/2023,Died In Committee,High,,https://legiscan.com/MS/bill/SB2763/2023,Angela Burks Hill,,"S 2023-01-16 Referred To Education, S 2023-01-31 Died In Committee",Failed,7776b743a9f3ac555cd34cdcd0b0f9fe,,,,,,,,,,,,,,,,,,,,,,,
Mississippi,SB2764,Parental rights in education; prohibit instruction regarding sexual orientation or gender identity in K-12.,Don't Say Gay/Forced Outing,1/31/2023,Died In Committee,High,,https://legiscan.com/MS/bill/SB2764/2023,Chris McDaniel,,"S 2023-01-16 Referred To Education, S 2023-01-31 Died In Committee",Failed,be0d393aad4564d64b8a81568858bb30,,,,,,,,,,,,,,,,,,,,,,,
Mississippi,SB2765,"""Mississippi Families' Rights and Responsibilities Act""; enact.",Don't Say Gay/Forced Outing,1/31/2023,Died In Committee,High,,https://legiscan.com/MS/bill/SB2765/2023,"Angela Burks Hill, Joseph Seymour, Kathy Chism",,"S 2023-01-16 Referred To Education, S 2023-01-31 Died In Committee",Failed,4704d16770eb28732fcd9fb6edfccffe,,,,,,,,,,,,,,,,,,,,,,,
Mississippi,SB2770,Gender reassignment surgery; criminalize performance of upon minors.,Gender Affirming Care Ban,1/31/2023,Died In Committee,High,Felony ban under 21 surgery only,https://legiscan.com/MS/bill/SB2770/2023,"Jeff Tate, Angela Burks Hill",,"S 2023-01-16 Referred To Judiciary, Division A, S 2023-01-31 Died In Committee",Failed,fa4859021eef1b94db4f1bdb35e387cf,,,,,,,,,,,,,,,,,,,,,,,
Mississippi,SB2773,The Defense of Title IX Act; enact.,Defining Trans People Out of the Law,1/31/2023,Died In Committee,High,,https://legiscan.com/MS/bill/SB2773/2023,"Angela Burks Hill, Jennifer Branning",,"S 2023-01-16 Referred To Judiciary, Division A, S 2023-01-31 Died In Committee",Failed,ff659357ba19a2f6c6b712016166360a,,,,,,,,,,,,,,,,,,,,,,,
Mississippi,SB2820,"""Transparency in Education Act""; prohibit certain curriculum in public schools without parental consent.",Don't Say Gay/Forced Outing,1/31/2023,Died In Committee,High,,https://legiscan.com/MS/bill/SB2820/2023,Angela Burks Hill,,"S 2023-01-16 Referred To Education, S 2023-01-31 Died In Committee",Failed,9d8327580d161ccf9f4f0766b3410ceb,,,,,,,,,,,,,,,,,,,,,,,
Mississippi,SB2861,Insurance; prohibit mandates for gender reassignment surgery or services.,Gender Affirming Care Ban,1/31/2023,Died In Committee,High,Does not require insurance to cover GAC,https://legiscan.com/MS/bill/SB2861/2023,"Melanie Sojourner, Kathy Chism, Chris McDaniel",,"S 2023-01-16 Referred To Insurance, S 2023-01-31 Died In Committee",Failed,b283681a52788402d546543eed649086,,,,,,,,,,,,,,,,,,,,,,,
Mississippi,SB2864,State funded health plans and Medicaid; prohibit payment of gender reassignment surgery or services.,Gender Affirming Care Ban,1/31/2023,Died In Committee,High,Full Adult Ban for all state insurance,https://legiscan.com/MS/bill/SB2864/2023,"Melanie Sojourner, Kathy Chism, Chris McDaniel",,"S 2023-01-16 Referred To Insurance;Medicaid, S 2023-01-31 Died In Committee",Failed,fb23518cc8e585fc93113865ae27a181,,,,,,,,,,,,,,,,,,,,,,,
Missouri,HB137,Changes provisions relating to instruction in human sexuality in schools,Don't Say Gay/Forced Outing,2/15/2023,Referred: Elementary and Secondary Education(H),High,,https://legiscan.com/MO/bill/HB137/2023,Brad Hudson,,"H 2022-12-01 Prefiled (H), H 2023-01-04 Read First Time (H), H 2023-01-05 Read Second Time (H), H 2023-02-15 Referred: Elementary and Secondary Education(H)",,941b4f582716c3911a71fe2cb1f8a177,,,,,,,,,,,,,,,,,,,,,,,
Missouri,HB170,Establishes guidelines for student participation in athletic contests organized by sex,Trans Sports Ban,1/24/2023,Public Hearing Completed (H),High,Sports ban. ,https://legiscan.com/MO/bill/HB170/2023,Brian Seitz,Hearing 2023-01-24 16:30 House Hearing Room 7,"H 2022-12-01 Prefiled (H), H 2023-01-04 Read First Time (H), H 2023-01-05 Read Second Time (H), H 2023-01-23 Referred: General Laws(H), H 2023-01-24 Public Hearing Completed (H)",,b8a7a40dabaa85804e06febf4b410701,,,,,,,,,,,,,,,,,,,,,,,
Missouri,HB183,Establishes guidelines for student participation in athletic contests organized by sex,Trans Sports Ban,2/21/2023,Referred: Rules - Legislative Oversight(H),High,Sports ban. ,https://legiscan.com/MO/bill/HB183/2023,Jamie Burger,"Hearing 2023-01-24 16:30 House Hearing Room 7, Hearing 2023-02-16 10:00 House Hearing Room 5","H 2022-12-01 Prefiled (H), H 2023-01-04 Read First Time (H), H 2023-01-05 Read Second Time (H), H 2023-01-23 Referred: General Laws(H), H 2023-01-24 Public Hearing Completed (H), H 2023-02-16 Executive Session Completed (H), H 2023-02-16 HCS Voted Do Pass (H), H 2023-02-16 HCS Reported Do Pass (H) - AYES: 9 NOES: 5 PRESENT: 0, H 2023-02-21 Referred: Rules - Legislative Oversight(H)",Pass Committee,d5cf7daa71cf93e447366696b3fa7597,,,,,,,,,,,,,,,,,,,,,,,
Missouri,HB192,Establishes a teacher bill of rights,Forced Misgendering,1/5/2023,Read Second Time (H),High,,https://legiscan.com/MO/bill/HB192/2023,Ed Lewis,,"H 2022-12-01 Prefiled (H), H 2023-01-04 Read First Time (H), H 2023-01-05 Read Second Time (H)",,2c82b3b69d50b08643b33b9e47efdf3e,,,,,,,,,,,,,,,,,,,,,,,
Missouri,HB337,Establishes guidelines for student participation in athletic contests organized by sex,Trans Sports Ban,1/24/2023,Public Hearing Completed (H),High,Sports ban. ,https://legiscan.com/MO/bill/HB337/2023,Bennie Cook,Hearing 2023-01-24 16:30 House Hearing Room 7,"H 2022-12-01 Prefiled (H), H 2023-01-04 Read First Time (H), H 2023-01-05 Read Second Time (H), H 2023-01-23 Referred: General Laws(H), H 2023-01-24 Public Hearing Completed (H)",,243a234229f395058d027ee0aa2bc025,,,,,,,,,,,,,,,,,,,,,,,
Missouri,HB419,Creates provisions relating to gender transition procedures,Gender Affirming Care Ban,2/21/2023,Referred: Rules - Legislative Oversight(H),High,essentially a SAFE act. ,https://legiscan.com/MO/bill/HB419/2023,Brad Hudson,"Hearing 2023-01-24 16:30 House Hearing Room 7, Hearing 2023-02-16 10:00 House Hearing Room 5","H 2022-12-13 Prefiled (H), H 2023-01-04 Read First Time (H), H 2023-01-05 Read Second Time (H), H 2023-01-23 Referred: General Laws(H), H 2023-01-24 Public Hearing Completed (H), H 2023-02-16 Executive Session Completed (H), H 2023-02-16 HCS Voted Do Pass (H), H 2023-02-16 HCS Reported Do Pass (H) - AYES: 8 NOES: 5 PRESENT: 1, H 2023-02-21 Referred: Rules - Legislative Oversight(H)",Pass Committee,36f5f692a4392344905d74f770d1e5c7,,,,,,,,,,,,,,,,,,,,,,,
Missouri,HB463,Creates provisions relating to gender transition procedures,Gender Affirming Care Ban,1/24/2023,Public Hearing Completed (H),High,SAFE act + Child abuse to corrace a child into gender transition. ,https://legiscan.com/MO/bill/HB463/2023,Mazzie Boyd,Hearing 2023-01-24 16:30 House Hearing Room 7,"H 2022-12-19 Prefiled (H), H 2023-01-04 Read First Time (H), H 2023-01-05 Read Second Time (H), H 2023-01-23 Referred: General Laws(H), H 2023-01-24 Public Hearing Completed (H)",,52d58c5203f5a5c21a67d6269e5c185c,,,,,,,,,,,,,,,,,,,,,,,
Missouri,HB498,Includes businesses that host drag performances in the definition of a sexually oriented business,Drag Ban,1/24/2023,Public Hearing Completed (H),High,Anti-drag/Anti-trans. ,https://legiscan.com/MO/bill/HB498/2023,Mazzie Boyd,Hearing 2023-01-24 16:30 House Hearing Room 7,"H 2022-12-21 Prefiled (H), H 2023-01-04 Read First Time (H), H 2023-01-05 Read Second Time (H), H 2023-01-23 Referred: General Laws(H), H 2023-01-24 Public Hearing Completed (H)",,96070d265ec2d4bc636049f19ef3cad9,,,,,,,,,,,,,,,,,,,,,,,
Missouri,HB540,Creates provisions relating to gender transition procedures,Gender Affirming Care Ban,1/24/2023,Public Hearing Completed (H),High,,https://legiscan.com/MO/bill/HB540/2023,Justin Sparks,Hearing 2023-01-24 16:30 House Hearing Room 7,"H 2022-12-30 Prefiled (H), H 2023-01-04 Read First Time (H), H 2023-01-05 Read Second Time (H), H 2023-01-23 Referred: General Laws(H), H 2023-01-24 Public Hearing Completed (H)",,66299c94802b417799fafea8fa4e998f,,,,,,,,,,,,,,,,,,,,,,,
Missouri,HB634,"Establishes protections of parental rights to direct the mental, emotional, and physical health and well-being of children",Don't Say Gay/Forced Outing,2/15/2023,Referred: Elementary and Secondary Education(H),High,,https://legiscan.com/MO/bill/HB634/2023,Ann Kelley,,"H 2023-01-04 Introduced and Read First Time (H), H 2023-01-05 Read Second Time (H), H 2023-02-15 Referred: Elementary and Secondary Education(H)",,af093673d57140b08fc7b63a6a1e2425,,,,,,,,,,,,,,,,,,,,,,,
Missouri,HB916,Creates provisions relating to gender transition procedures,Gender Affirming Care Ban,1/25/2023,Referred: General Laws(H),High,under 18,https://legiscan.com/MO/bill/HB916/2023,Cyndi Buchheit-Courtway,,"H 2023-01-23 Introduced and Read First Time (H), H 2023-01-24 Read Second Time (H), H 2023-01-25 Referred: General Laws(H)",,05c3c4c0a8a3c2542c05e90e74ff24cd,,,,,,,,,,,,,,,,,,,,,,,
Missouri,SB134,Prohibits the discussion of gender identity or sexual orientation by school personnel,Don't Say Gay/Forced Outing,2/14/2023,SCS Voted Do Pass S Education and Workforce Development Committee (0608S.06C),High,,https://legiscan.com/MO/bill/SB134/2023,Mike Moon,Hearing 2023-02-07 08:15 Senate Lounge,"S 2022-12-01 Prefiled, S 2023-01-04 S First Read, S 2023-01-26 Second Read and Referred S Education and Workforce Development Committee, S 2023-02-07 Hearing Conducted S Education and Workforce Development Committee, S 2023-02-14 SCS Voted Do Pass S Education and Workforce Development Committee (0608S.06C)",Pass Committee,adc23d6eedb7caa915bad75150b95903,,,,,,,,,,,,,,,,,,,,,,,
Missouri,SB14,Modifies provisions relating to amending birth certificates,Birth Certificate Change Ban,2/20/2023,Voted Do Pass S Emerging Issues Committee,High,,https://legiscan.com/MO/bill/SB14/2023,Mike Cierpiot,"Hearing 2023-01-31 10:00 SCR 1, Hearing 2023-02-07 10:00 SCR 1","S 2022-12-01 Prefiled, S 2023-01-04 S First Read, S 2023-01-12 Second Read and Referred S Emerging Issues Committee, S 2023-01-31 Hearing Cancelled S Emerging Issues Committee, S 2023-02-07 Hearing Conducted S Emerging Issues Committee, S 2023-02-20 Voted Do Pass S Emerging Issues Committee",Pass Committee,3d9ced5139e1b2cee920e00908bac62f,,,,,,,,,,,,,,,,,,,,,,,
Missouri,SB164,"Establishes the ""Missouri Save Adolescents from Experimentation (SAFE) Act""",Gender Affirming Care Ban,2/20/2023,"Bill Combined w/(SCSs SB 49, 236 & 164)",High,Gender affirming care ban under 18. Pretty much a SAFE act. ,https://legiscan.com/MO/bill/SB164/2023,Jill Carter,Hearing 2023-02-14 10:00 SCR 1,"S 2022-12-01 Prefiled, S 2023-01-04 S First Read, S 2023-01-26 Second Read and Referred S Emerging Issues Committee, S 2023-02-14 Hearing Conducted S Emerging Issues Committee, S 2023-02-20 Bill Combined w/(SCSs SB 49, 236 & 164)",,ecea5e2d8b371fe25f095cd290b56929,,,,,,,,,,,,,,,,,,,,,,,
Missouri,SB165,"Creates the ""Save Women's Sports Act"" and provisions regarding usage of school locker rooms",Trans Sports Ban,1/31/2023,Hearing Conducted S Emerging Issues Committee,High,,https://legiscan.com/MO/bill/SB165/2023,Jill Carter,Hearing 2023-01-31 10:00 SCR 1,"S 2022-12-01 Prefiled, S 2023-01-04 S First Read, S 2023-01-26 Second Read and Referred S Emerging Issues Committee, S 2023-01-31 Hearing Conducted S Emerging Issues Committee",,c0b498eaee923c3e545fa15e77e6bc18,,,,,,,,,,,,,,,,,,,,,,,
Missouri,SB2,"Establishes the ""Save Women's Sports Act"" relating to female-only athletics in middles schools, high schools, and colleges",Trans Sports Ban,1/31/2023,Hearing Conducted S Emerging Issues Committee,High,,https://legiscan.com/MO/bill/SB2/2023,Denny Hoskins,Hearing 2023-01-31 10:00 SCR 1,"S 2022-12-01 Prefiled, S 2023-01-04 S First Read, S 2023-01-12 Second Read and Referred S Emerging Issues Committee, S 2023-01-31 Hearing Conducted S Emerging Issues Committee",,c20021a21076cff1119f5f3568c0f2ed,,,,,,,,,,,,,,,,,,,,,,,
Missouri,SB236,"Establishes the ""Missouri Save Adolescents from Experimentation (SAFE) Act""",Gender Affirming Care Ban,2/20/2023,"Bill Combined w/(SCSs SB 49, 236 & 164)",High,Gender affirming care ban under 18. Pretty much a SAFE act. ,https://legiscan.com/MO/bill/SB236/2023,Denny Hoskins,Hearing 2023-02-14 10:00 SCR 1,"S 2022-12-01 Prefiled, S 2023-01-04 S First Read, S 2023-02-09 Second Read and Referred S Emerging Issues Committee, S 2023-02-14 Hearing Conducted S Emerging Issues Committee, S 2023-02-20 Bill Combined w/(SCSs SB 49, 236 & 164)",,9639e5a4ce4064ba8ade8b2df68e8100,,,,,,,,,,,,,,,,,,,,,,,
Missouri,SB281,Prohibits hormonal or surgical gender reassignment for a child under eighteen years of age,Gender Affirming Care Ban,2/23/2023,Second Read and Referred S Emerging Issues Committee,High,,https://legiscan.com/MO/bill/SB281/2023,William Eigel,,"S 2022-12-01 Prefiled, S 2023-01-04 S First Read",,fded9296bcdb5bec584cb2e86d77b4d5,,,,,,,,,,,,,,,,,,,,,,,
Missouri,SB29,Prohibits an athletic team sponsored by a school from allowing a student to compete in an athletic competition designated for the opposite biological sex,Trans Sports Ban,1/31/2023,Hearing Conducted S Emerging Issues Committee,High,Sports ban. ,https://legiscan.com/MO/bill/SB29/2023,Tony Luetkemeyer,Hearing 2023-01-31 10:00 SCR 1,"S 2022-12-01 Prefiled, S 2023-01-04 S First Read, S 2023-01-12 Second Read and Referred S Emerging Issues Committee, S 2023-01-31 Hearing Conducted S Emerging Issues Committee",,569964820cf203d9908e4c3e2fc38c36,,,,,,,,,,,,,,,,,,,,,,,
Missouri,SB377,Crates new provisions relating to public contracts,Ban on Public Investment in ESG Funds,2/23/2023,Second Read and Referred S Governmental Accountability Committee,High,,https://legiscan.com/MO/bill/SB377/2023,Mary Coleman,,"S 2022-12-20 Prefiled, S 2023-01-04 S First Read, S 2023-02-23 Second Read and Referred S Governmental Accountability Committee",,78c9ab16746dd59a8fb8a9739fc8eddc,,,,,,,,,,,,,,,,,,,,,,,
Missouri,SB39,Establishes guidelines for student participation in athletic contests organized by sex,Trans Sports Ban,2/27/2023,Informal Calendar S Bills for Perfection,High,,https://legiscan.com/MO/bill/SB39/2023,"Holly Thompson Rehder, Mike Moon, Jill Carter, Ben Brown, Rick Brattin, Denny Hoskins",Hearing 2023-01-31 10:00 SCR 1,"S 2022-12-01 Prefiled, S 2023-01-04 S First Read, S 2023-01-12 Second Read and Referred S Emerging Issues Committee, S 2023-01-31 Hearing Conducted S Emerging Issues Committee, S 2023-02-02 Voted Do Pass S Emerging Issues Committee, S 2023-02-02 Reported from S Emerging Issues Committee, S 2023-02-06 Bill Placed on Informal Calendar, S 2023-02-27 Informal Calendar S Bills for Perfection",Pass Committee,e79897ff3048da9dd96ee60b4e4502d0,,,,,,,,,,,,,,,,,,,,,,,
Missouri,SB390,Establishes provisions relating to classroom instruction on gender identity and sexual orientation in certain grade levels,Don't Say Gay/Forced Outing,1/4/2023,S First Read,High,Ban on discussion of sexual orientation or gender identiy through the 3rd grade. ,https://legiscan.com/MO/bill/SB390/2023,Rick Brattin,,"S 2022-12-28 Prefiled, S 2023-01-04 S First Read",,969d22790be16982839072f503b9d126,,,,,,,,,,,,,,,,,,,,,,,
Missouri,SB42,Modifies provisions regarding elementary and secondary education,Trans Sports Ban,1/24/2023,"Bill Combined w/SCS SBs 4, 42 & 89",High,Anti-CRT bill and parent's bill of rights,https://legiscan.com/MO/bill/SB42/2023,Rick Brattin,Hearing 2023-01-24 08:00 Senate Lounge,"S 2022-12-01 Prefiled, S 2023-01-04 S First Read, S 2023-01-12 Second Read and Referred S Education and Workforce Development Committee, S 2023-01-24 Hearing Conducted S Education and Workforce Development Committee, S 2023-01-24 Bill Combined w/SCS SBs 4, 42 & 89",,772447e2b05dc9d91a81a590781fce6a,,,,,,,,,,,,,,,,,,,,,,,
Missouri,SB429,Modifies provisions relating to sexually oriented businesses,Drag Ban,1/4/2023,S First Read,High,,https://legiscan.com/MO/bill/SB429/2023,Jill Carter,,"S 2023-01-03 Prefiled, S 2023-01-04 S First Read",,5f70bb4c2a1220f15fb873a9f6006096,,,,,,,,,,,,,,,,,,,,,,,
Missouri,SB430,Prohibits public entities from entering into certain contracts,Anti-Boycotts Act,1/4/2023,S First Read,High,,https://legiscan.com/MO/bill/SB430/2023,Jill Carter,,"S 2023-01-03 Prefiled, S 2023-01-04 S First Read",,2810156b72249315a0b20d95f011d447,,,,,,,,,,,,,,,,,,,,,,,
Missouri,SB436,Modifies provisions relating to fiduciary duties for investments of public employee retirement systems,Ban on Public Investment in ESG Funds,1/4/2023,S First Read,High,Bans public money from investing in funds that don't invest in companies that fail to provide gender affirming care,https://legiscan.com/MO/bill/SB436/2023,Jill Carter,,"S 2023-01-03 Prefiled, S 2023-01-04 S First Read",,14a538d28c63eb07edc9651ba3963e0b,,,,,,,,,,,,,,,,,,,,,,,
Missouri,SB48,"Establishes the ""Save Women's Sports Act"" relating to female-only athletics in middle schools, high schools, and colleges",Trans Sports Ban,1/31/2023,Hearing Conducted S Emerging Issues Committee,High,,https://legiscan.com/MO/bill/SB48/2023,Mike Moon,Hearing 2023-01-31 10:00 SCR 1,"S 2022-12-01 Prefiled, S 2023-01-04 S First Read, S 2023-01-12 Second Read and Referred S Emerging Issues Committee, S 2023-01-31 Hearing Conducted S Emerging Issues Committee",,a617c53ae0889d395fd75dd10dad48d5,,,,,,,,,,,,,,,,,,,,,,,
Missouri,SB49,"Establishes the ""Missouri Save Adolescents from Experimentation (SAFE) Act""",Gender Affirming Care Ban,2/27/2023,Formal Calendar S Bills for Perfection,High,SAFE act,https://legiscan.com/MO/bill/SB49/2023,"Mike Moon, William Eigel, Rick Brattin",Hearing 2023-02-14 10:00 SCR 1,"S 2022-12-01 Prefiled, S 2023-01-04 S First Read, S 2023-01-12 Second Read and Referred S Emerging Issues Committee, S 2023-02-14 Hearing Conducted S Emerging Issues Committee, S 2023-02-20 SCS Voted Do Pass (w/SCSs SB 49, 236, &164) Emerging Issues Committee (0202S.02C), S 2023-02-21 Reported from S Emerging Issues Committee w/SCS, S 2023-02-27 Formal Calendar S Bills for Perfection",Pass Committee,e09e6c58de86d4d7f02c80d880b2fd09,,,,,,,,,,,,,,,,,,,,,,,
Missouri,SB497,Prohibits schools from providing course materials or instruction on gender identity or gender reassignment,Prohibits Gender Identity Instruction,1/17/2023,S First Read,High,,https://legiscan.com/MO/bill/SB497/2023,William Eigel,,S 2023-01-17 S First Read,,1c6f2c2f73c094152890d5e5399484d5,,,,,,,,,,,,,,,,,,,,,,,
Missouri,SB598,"Establishes the ""Missouri Child and Adolescent Protection Act""",Gender Affirming Care Ban,2/6/2023,S First Read,High,,https://legiscan.com/MO/bill/SB598/2023,Rick Brattin,,S 2023-02-06 S First Read,,1e4ada3a68cbc080b9f1f883410eb86f,,,,,,,,,,,,,,,,,,,,,,,
Missouri,SB87,"Establishes the ""Save Women's Sports Act""",Trans Sports Ban,1/31/2023,Hearing Conducted S Emerging Issues Committee,High,,https://legiscan.com/MO/bill/SB87/2023,Ben Brown,Hearing 2023-01-31 10:00 SCR 1,"S 2022-12-01 Prefiled, S 2023-01-04 S First Read, S 2023-01-12 Second Read and Referred S Emerging Issues Committee, S 2023-01-31 Hearing Conducted S Emerging Issues Committee",,21868e0286049d2954f1cf3c051c368a,,,,,,,,,,,,,,,,,,,,,,,
Missouri,HB1157,Prohibits discrimination against health care professionals who refuse to assist in medical procedures or treatments relating to sex reassignment or gender identity transitioning,Legal Discrimination in Healthcare,2/15/2023,Read Second Time (H),High,,https://legiscan.com/MO/bill/HB1157/2023,Brad Hudson,,"H 2023-02-14 Introduced and Read First Time (H), H 2023-02-15 Read Second Time (H)",,cc0f5c37e6bd49fe1f15832eace38d82,,,,,,,,,,,,,,,,,,,,,,,
Missouri,HB1258,"Enacts provisions to protect student, parent, and teacher rights regarding school employees and independent contractors",Forced Misgendering,2/23/2023,Introduced and Read First Time (H),High,,https://legiscan.com/MO/bill/HB1258/2023,Hardy Billington,,H 2023-02-23 Introduced and Read First Time (H),,ba0854b3f9e53081a59c650cf894eb0d,,,,,,,,,,,,,,,,,,,,,,,
Montana,HB234,Revise dissemination of obscene material to minors laws,Book Ban,2/10/2023,(S) First Reading,High,,https://legiscan.com/MT/bill/HB234/2023,Bob Phalen,Hearing 2023-01-19 08:30 Room 137," 2022-10-28 (C) Draft Request Received,  2022-12-28 (C) Draft to Requester for Review,  2022-12-28 (C) Draft to Requester for Review,  2023-01-03 (C) Draft in Legal Review,  2023-01-03 (C) Draft in Edit,  2023-01-04 (C) Draft to Drafter - Edit Review,  2023-01-05 (C) Draft in Input/Proofing,  2023-01-05 (C) Draft in Final Drafter Review,  2023-01-05 (C) Bill Draft Text Available Electronically,  2023-01-05 (C) Executive Director Review,  2023-01-06 (C) Draft in Assembly,  2023-01-06 (C) Draft Ready for Delivery,  2023-01-06 (C) Executive Director Final Review,  2023-01-07 (C) Draft Ready for Delivery,  2023-01-10 (C) Draft Delivered to Requester, H 2023-01-12 (H) Introduced,  2023-01-12 (C) Introduced Bill Text Available Electronically, H 2023-01-13 (H) Referred to Committee (H) Judiciary, H 2023-01-13 (H) First Reading, H 2023-01-19 (H) Hearing (H) Judiciary,  2023-01-22 (C) Amendments Available, H 2023-01-31 (H) Committee Executive Action--Bill Passed as Amended (H) Judiciary, H 2023-01-31 (H) Committee Report--Bill Passed as Amended (H) Judiciary,  2023-01-31 (C) Printed - New Version Available, H 2023-02-08 (H) Scheduled for 2nd Reading, H 2023-02-08 (H) Motion Failed, H 2023-02-08 (H) Motion Carried, H 2023-02-08 (H) 2nd Reading Passed, H 2023-02-09 (H) Scheduled for 3rd Reading, H 2023-02-09 (H) 3rd Reading Passed, H 2023-02-10 (H) Transmitted to Senate, S 2023-02-10 (S) First Reading",Pass One Chamber,fb54ffb5805535182237d36bedd0e755,,,,,,,,,,,,,,,,,,,,,,,
Montana,HB303,Implement Medical Ethics and Diversity Act,Legal Discrimination in Healthcare,2/8/2023,(S) First Reading,High,Allows Employeers to as well,https://legiscan.com/MT/bill/HB303/2023,Amy Regier,Hearing 2023-01-30 08:00 Room 137," 2022-11-01 (C) Draft Request Received,  2022-11-28 (C) Draft to Requester for Review,  2022-12-12 (C) Draft to Requester for Review,  2022-12-30 (C) Draft to Requester for Review,  2023-01-09 (C) Draft to Requester for Review,  2023-01-10 (C) Draft to Requester for Review,  2023-01-11 (C) Draft to Requester for Review,  2023-01-11 (C) Draft in Legal Review,  2023-01-12 (C) Draft in Edit,  2023-01-16 (C) Draft to Drafter - Edit Review,  2023-01-16 (C) Draft in Input/Proofing,  2023-01-17 (C) Draft in Final Drafter Review,  2023-01-17 (C) Bill Draft Text Available Electronically,  2023-01-17 (C) Executive Director Review,  2023-01-17 (C) Draft in Assembly,  2023-01-18 (C) Draft Ready for Delivery,  2023-01-18 (C) Executive Director Final Review,  2023-01-18 (C) Draft Ready for Delivery,  2023-01-20 (C) Draft Delivered to Requester, H 2023-01-21 (H) Introduced,  2023-01-23 (C) Introduced Bill Text Available Electronically, H 2023-01-24 (H) Referred to Committee (H) Judiciary, H 2023-01-24 (H) First Reading, H 2023-01-27 (H) Motion Carried, H 2023-01-30 (H) Hearing (H) Judiciary, H 2023-02-02 (H) Committee Executive Action--Bill Passed (H) Judiciary, H 2023-02-02 (H) Committee Report--Bill Passed (H) Judiciary,  2023-02-06 (C) Amendments Available, H 2023-02-06 (H) Scheduled for 2nd Reading, H 2023-02-06 (H) 2nd Reading Motion to Amend Failed, H 2023-02-06 (H) 2nd Reading Passed, H 2023-02-07 (H) Scheduled for 3rd Reading, H 2023-02-07 (H) 3rd Reading Passed, H 2023-02-07 (H) Transmitted to Senate, S 2023-02-08 (S) First Reading",Pass One Chamber,9ac5181e135a547e561519b8c9d805a4,,,,,,,,,,,,,,,,,,,,,,,
Montana,HB359,Prohibit minors from attending drag shows,Drag Ban,2/24/2023,(H) Transmitted to Senate,High,,https://legiscan.com/MT/bill/HB359/2023,Braxton Mitchell,Hearing 2023-02-09 08:00 Room 137," 2022-11-22 (C) Draft Request Received,  2022-12-16 (C) Draft in Legal Review,  2022-12-19 (C) Draft in Edit,  2022-12-19 (C) Draft to Drafter - Edit Review,  2022-12-19 (C) Draft in Input/Proofing,  2022-12-20 (C) Draft in Final Drafter Review,  2022-12-20 (C) Bill Draft Text Available Electronically,  2022-12-20 (C) Executive Director Review,  2022-12-26 (C) Draft in Assembly,  2022-12-27 (C) Draft Ready for Delivery,  2022-12-27 (C) Executive Director Final Review,  2022-12-28 (C) Draft Ready for Delivery,  2023-01-26 (C) Draft Delivered to Requester, H 2023-01-28 (H) Introduced, H 2023-01-30 (H) Referred to Committee (H) Judiciary, H 2023-01-30 (H) First Reading,  2023-01-31 (C) Introduced Bill Text Available Electronically,  2023-01-31 (C) Amendments Available, H 2023-02-07 (H) Sponsor List Modified, H 2023-02-09 (H) Hearing (H) Judiciary, H 2023-02-15 (H) Committee Executive Action--Bill Passed as Amended (H) Judiciary,  2023-02-16 (C) Printed - New Version Available, H 2023-02-16 (H) Committee Report--Bill Passed as Amended (H) Judiciary, H 2023-02-23 (H) Scheduled for 2nd Reading, H 2023-02-23 (H) 2nd Reading Motion to Amend Failed, H 2023-02-23 (H) Motion Carried, H 2023-02-23 (H) 2nd Reading Passed, H 2023-02-24 (H) Scheduled for 3rd Reading, H 2023-02-24 (H) 3rd Reading Passed, H 2023-02-24 (H) Transmitted to Senate",Pass One Chamber,7297294b03e591b199ea54e32f865113,,,,,,,,,,,,,,,,,,,,,,,
